Perhaps the Greatest of All Time?	None	I never liked the IMDb top 250 list. So i haven&#x27;t thought about this one for a very long time. Then i watched Shawshank and immediately became a fan. Somewhere i read that Godfather was at the top of the 250 before Shawshank and that&#x27;s when i decided to take a chance with Godfather. <br><br>I wasn&#x27;t a fan of gangster flicks so it&#x27;s fair to say i never thought i&#x27;d sit through all 3 hours and minutes. What can i say? This film changed every thing about my taste in movies. After watching this i ended up as a fan of gangster movies and i went on to watch some pretty old movies and some of the longest running films. (And now i am a fan of IMDb&#x27;s 250)<br><br>I had a go at this movie again (for the 5th time)yesterday and compelled to write a review here.I&#x27;m not gonna say anything new here after all these 1687 reviews but anyone reading this i guess you probably watched the movie and inspired enough to read the reviews here. If that so give me a thumps up! <br><br>In my opinion The Greatest Gangster Film ever. And Arguably the greatest movie of all time. 10 out of 10. 
Mario Puzo's soapy Mafia saga	United Kingdom	Think epic novel crossed with Mafia speak.<br><br>Imagine excellent cinematography and direction, a great musical theme, violence, tragedy, spectacle, and the family, and a cast which can't be faulted, and here you have a film which fits the bill on all counts.<br><br>Vito Corleone (Marlon Brando in one of his greatest roles, one which he supposedly didn't initially want to play) is the powerful Mafia Don we meet early in the film. He has three sons (Sonny - James Caan; Fredo - John Cazale; and Michael - Al Pacino) and a daughter (Talia Shire), and an adopted son (Tom Hagen - Robert Duvall). These are his beloved family and the centre of his world. His day job involves building his empire by making 'offers you can't refuse'.<br><br>'The Godfather' was the first film in a trilogy following the fortunes of the Corleone family, and I think the best. It has some well-presented set pieces (Connie's wedding; Sonny's murder; Michael's killing of family enemies in the restaurant; the horse's head in the bed; and Vito's death while playing with his grand-child) and is extremely well-written. The novel itself was more soapy, a work of pulp fiction - the film pulls it together and gives it a bit more class.<br><br>I particularly like the characterisations of Vito and his sons. Vito is assured in his role at the head of the premier Mafia family. Sonny is a vain libertine who is hot-headed. Fredo is a weak disappointment. Michael takes his place in the family when he has to (in fact throughout the three films he is shown to be far more ruthless than any of his relatives).<br><br>Is 'The Godfather' the greatest film ever made? No, but it is one of the best. Certainly in the top 10 films of the 1970s. 
This Consummate, Quintessential World-Class Masterwork Is Head Over Heels Better Than The Dark Knight By a Long Shot, and You All Know It.	Cincinnati, OH, United States	The Godfather soaks us up so dry it never has to hustle through. There is something in the deliberate journey of time as Don Corleone entrusts his reins of power that would have made an hour-and-forty-minute-long thriller unbecoming. Even at this length, there are characters in relationships you understand merely by the way they exchange looks, or don&#39;t, or speak to each other. We are inclined to associate with Don Corleone&#39;s family not because we enjoy their gang wars, but because we have been with them from the opening, where they celebrate a wonderful wedding full of old Italian songs, dances and love, and later we watch them await violence while sitting at the kitchen table and eating the pasta cooked by Clemenza.<br><br>Endowed with Nino Rota&#39;s immortal, extraordinary music score, this consummate masterpiece is entitled The Godfather, a title not only relevant because of the wise Don Vito Corleone, who heads his family with unruffled effectiveness, but also to his son Michael, a hesitant college graduate who is in the beginning feeling shame of his criminal background and firm on living the life of an upright citizen. Coppola follows Michael&#39;s ascent to power within the family, on top of the concurrent wearing away of his heart.<br><br>Vito Corleone himself is not even the central character in the drama. He is a relaxed puppeteer. The central character, really, slowly comes to be the youngest, smartest son, Michael, who absorbs the spirit of his father&#39;s standing while reworking his outdated customs. The Godfather&#39;s function in the family enterprise is illustrated by his name, existing outside the following generation which will continue and, with any luck, point the family into legal endeavors. Marlon Brando, who plays Vito as a perceptive, resilient model family man in his wise latter years, in fact has the character lead whereas Al Pacino, as Michael, is the lead. Unhurried and physically at ease, one knows his reaction would be of great anger if he were to be harassed. In the face of his grooming, which is given the least effort needed for a good, attractive look, there&#39;s a look about him as if he&#39;s just awakened, and that first groggy morning hour is the time he always seems to be stuck within. His presence is imprinted with a brooding, nonchalant style. Smooth and understated, he musters a searing inner fire that makes his tremendous character arc so impactful and amazing. But Brando&#39;s performance, as always, is expertly offhand, and it earned him an Oscar. His voice and physicality consciously lack precision, and the incidental result is of a man so at home with power that he no longer needs to prompt anyone.<br><br>The remaining actors furnish one case-in-point after another of superb, instinctive casting. Macho and tempestuous James Caan and pragmatic and down-to-earth Robert Duvall, for instance, hardly have to act to embody their roles. While this, the quintessential crime drama, is an extensive, painstakingly thorough film of nearly three hours, there genuinely isn&#39;t time to go into the personal history and distinctiveness of such characters as Clemenza (Richard Castellano), the hardened, heavyset family lieutenant, Jack Woltz (John Marley, who was excellent in Faces), the movie baron, Luca Brasi, the faithful contract killer, McCluskey (Sterling Hayden), the corrupt cop, and the rest. Coppola meets this issue head-on with unassuming typecasting. A character who appears in a story long enough to say hello and goodbye, no matter how small, better be real enough that you can assume who he votes for.<br><br>Really, the opening wedding sequence deeply familiarizes us with the dynamics of the family, an authoritarianism in the guise of Old World ceremony. Coppola asserts a style and a visual guise that is quintessential, through Gordon Willis&#39;s reddish-brown tinted, overexposed cinematography, everything period furnishings.<br><br>Men wearing black suits sitting in dark boardrooms parley the particulars of prostitution and gambling, and fashion an isolated society that issues stability and integrity, that is in terms of their own advantages. Politicians and policemen are merely intimidated or trafficked. Esteem and reliability are the legal tender, and all influence emerges from the Don, who calmly keeps quiet control over his territory.<br><br>His successor is Santino, the Caan role, always cooking with implicit rage and is incredibly eager to inherit the position. His brothers are Michael and the sniveling pushover Fredo, played by the late John Cazale. The Duvall role is Tom Hagen, the unemotional, factual family lawyer and all-around professional shrewd pragmatist embraced by Vito as a child and brought up as his own. The women are not much more than background scenery. Vito&#39;s wife scarcely speaks or even appears. Sonny&#39;s wife suffers silently through his shameless infidelity, and the Corleone daughter, Connie, played by Talia Shire, is so often overlooked that her brothers take no notice of her unless she protests about her disgusting husband having beaten her.<br><br>An assault on Vito&#39;s life alters Michael&#39;s attitude, and he comes back to help defend his family&#39;s wellbeing as Sonny takes rash control, making a mess of the business and laying everyone on the line, while the laid up and incapacitated Vito can do no more than look on. Michael&#39;s bona fide defining moment make its mark in one of the film&#39;s most unforgettable scenes of ultimate virtuosity. He takes it upon himself to do a hit at a small Italian restaurant, using a gun that was left for him in a bathroom stall. This forces him into banishment in Sicily, where he solidifies his determination to return his family to a status of eminence. 
Sets the standard for the gangster art film.	Massachusetts	The Godfather (1972) did for gangster movies what 2001: A Space Odyssey did for science fiction. Like Stanley Kubrick, Francis Ford Coppola re-energized and, to a degree, reinvented a basic Hollywood pulp fiction action-entertainment genre, using it as a vehicle for the high artistic ambitions of a post-New Wave film &quot;auteur.&quot; <br><br>Within his narrower focus on 20th century American civilization (as opposed to Kubrick&#39;s philosophical speculations on human evolution), Coppola shapes the story of the Corleone Mafia family into an epic/satiric vision of American business, government, justice, and moral decline. The Godfather&#39;s brilliantly constructed opening sequence, the wedding of Don Corleone&#39;s daughter, not only establishes the Don&#39;s character, the nature of his organization, the role of family and Sicilian tradition in his world, and the character of his sons (three natural and one adopted), but also establishes the relationship between the Don&#39;s world and &quot;legitimate&quot; society. For instance, the film&#39;s opening words are those of Bonasera, a petitioner for a wedding &quot;favor,&quot; whose voice over a dark screen first asserts the American Dream, &quot;I believe in America. America has made my fortune,&quot; and then turns to disillusioned contradiction: &quot;for justice, we must go to Don Corleone.&quot;<br><br>Numerous subsequent lines of dialog establish literal or metaphorical connections between the criminal underworld and social institutions. Some of the most memorable ones include: &quot;My father is no different than any powerful man, any man with power, like a president or senator.&quot;&quot;Now we have the unions, we have the gambling; and they&#39;re the best things to have. But narcotics is a thing of the future. And if we don&#39;t get a piece of that action, we risk everything we have. I mean not now, but ten years from now.&quot; &quot;It&#39;s not personal, Sonny. It&#39;s strictly business.&quot; And most famously of all: &quot;I&#39;m gonna make him an offer he can&#39;t refuse.&quot; <br><br>The film&#39;s title refers to two godfathers, the original Don Corleone and his youngest son - and ultimate successor - Michael. Marlon Brando&#39;s performance as Don Corleone, for which he was awarded a Best Actor Academy Award, balances the Don&#39;s subtly counter-pointed functions as beloved, grandfatherly patriarch and fearsome, brutal crime boss. Yet Michael, as the character most centrally and significantly affected by the film&#39;s plot and played with a brilliance equaling Brando&#39;s by a then unknown Al Pacino, is the principal protagonist.<br><br>At the wedding, Michael&#39;s centrality is signaled by the Don&#39;s frantic call, &quot;Where&#39;s Michael? We are not taking the picture without Michael!&quot; A World War II hero still in decorated uniform, Michael is meanwhile busy differentiating himself from his family to his girl friend and future second wife, Kay (Diane Keaton). &quot;Luca Brasi held a gun to the band leader&#39;s head,&quot; he relates, &quot;and my father assured him that either his signature or his brains would be on the release. That&#39;s my family Kay. It&#39;s not me.&quot; Michael&#39;s initial disinterest in Mafia activities is reinforced by his adoring father who envisions him as &quot;Senator Corleone&quot; or &quot;Governor Corleone&quot; not as his successor. That role is reserved for his hot-headed eldest son, Sonny (James Caan). But, of course, events conspire to suck Michael in - and to keep sucking him in right through Godfather III - the assassination attempt on his father, Michael&#39;s coolly murderous response, the car bomb meant for him that kills his first wife, the Sicilian beauty Apollonia (aptly named for the god of sun light), the riddled body of his brother Sonny. Inevitably, a morally darkened Michael emerges at the end of the film, one who outdoes his father in guile and ruthlessness and whose final brutal and deceitful acts in Godfather I seal his doom as a Macbeth-like villainous tragic hero.<br><br>Shot mainly on location in various New York City locales, The Godfather spans a ten-year post World War II period. A multitude of props, costumes, and pop culture artifacts arranged by the film&#39;s art director, Warren Clyner, and production designer, Dean Tavoularis, lend a rich sense of historical authenticity to the film&#39;s mise en scene. Moreover, the film&#39;s lighting by brilliant cinematographer Gordon (&quot;prince of darkness&quot;) Willis, contributes greatly to both the film&#39;s realism and its thematic symbolism. Compare, for instance, the use of extremely dark, shadowy, color desaturated interior scenes &#150; especially in the Don&#39;s home office &#150; with the brightly lit, vivaciously colored outdoor wedding scene or the sun-drenched, romanticized Sicilian landscape.<br><br>The Godfather is edited in the classic Hollywood invisible style, subordinating technique to the needs of narrative and visual continuity. But the film is expertly edited nonetheless. In particular one might note the stunning use of multiple parallel editing that occurs in one of the film&#39;s last scenes: the assassination of the other crime family heads, elaborately planned to coincide with Michael&#39;s participation in the baptism of sister Connie&#39;s child. Likewise, The Godfather&#39;s soundtrack is a memorable combination of diegetic period music (&quot;Have Yourself a Merry Little Christmas&quot;) and a lush, operatic original score composed by one of the greatest film music composers, Nino Rota (a frequent Fellini collaborator as in 8 1/2).<br><br>With The Godfather and its even more ambitious sequel, Coppola pushed the classic gangster film in the direction of high art and released it once and for all from the moralistic grip of the Hays Code, which arose in the 1930s in large part as a response to the romanticizing of criminals found in such early examples of the gangster genre as Scarface, Little Cesar, and Public Enemy. Not only did the code regulate the degree and nature of sexual and violent imagery in all films, but it also specifically required that criminals be portrayed as morally repulsive social deviants and that plots involving them be resolved with the implicit or explicit lesson that &quot;crime did not pay.&quot; Fortunately for American popular culture The Godfather radically rewrote the rulebook and paved the way for a generation&#39;s-worth of gangster masterpieces ranging from the Scarface remake to Pulp Fiction to The Sopranos. 
gangster	United States	opularly viewed as one of the best American films ever made, the multi-generational crime saga The Godfather is a touchstone of cinema: one of the most widely imitated, quoted, and lampooned movies of all time. Marlon Brando and Al Pacino star as Vito Corleone and his youngest son, Michael, respectively. It is the late 1940s in New York and Corleone is, in the parlance of organized crime, a &#x22;godfather&#x22; or &#x22;don,&#x22; the head of a Mafia family. Michael, a free thinker who defied his father by enlisting in the Marines to fight in World War II, has returned a captain and a war hero. Having long ago rejected the family business, Michael shows up at the wedding of his sister, Connie (Talia Shire), with his non-Italian girlfriend, Kay (Diane Keaton), who learns for the first time about the family &#x22;business.&#x22; A few months later at Christmas time, the don barely survives being shot by gunmen in the employ of a drug-trafficking rival whose request for aid from the Corleones&#x27; political connections was rejected. After saving his father from a second assassination attempt, Michael persuades his hotheaded eldest brother, Sonny (James Caan), and family advisors Tom Hagen (Robert Duvall) and Sal Tessio (Abe Vigoda) that he should be the one to exact revenge on the men responsible. 
Best movie ever	Romania	I love this movie. It&#x27;s the greatest movie I ever seen in my life. Every time I watch it I see something new. It has drama, action and even comedy. The story is great. It centers around the most powerful New York mafia run by The Godfather. It teaches you about family and betrayal, about life in general. All that Michael does is for his family. He even sacrifices his relationship with his girlfriend to protect his family. The movie is amazingly shot, giving it amazing light. The characters are bigger than life and played by some of the greatest actors to ever live. The soundtrack is very good. All in all is must see. 
A must watch especially with directors commentary	United States	Excellent film, from the opening to the end you sense a genuine touch into lives of the characters and the world created by the actors and Coppola.<br><br>Just the intro of the movie immediately reveals the world you&#x27;ve entered and in the next few scenes you familiarized with family which shows who they are at heart.<br><br>Personally, I love a movie that takes the time to deliver a well told story and The Godfather does just that - the scenes revealing the inner struggles of the characters, the conflict in matters regarding their world, and how each character deals with issues is well done.<br><br>When a movie makes all their scenes have significant impact so much so that you don&#x27;t find yourself wanting to pick favorites, you know you&#x27;re dealing with greatness.<br><br>From beginning to end I was immersed, and if you like well done movies I&#x27;m sure you&#x27;ll experience the same. 
Mind blowing drama, a must see	wow	Taking a best-selling novel of more drive than genius (Mario Puzo&#x27;s The Godfather), about a subject of something less than common experience (the Mafia), involving an isolated portion of one very particular ethnic group (first-generation and second-generation Italian-Americans), Francis Ford Coppola has made one of the most brutal and moving chronicles of American life ever designed within the limits of popular entertainment.<br><br>The Godfather, which opened at five theaters here yesterday, is a superb Hollywood movie that was photographed mostly in New York (with locations in Las Vegas, Sicily, and Hollywood). It&#x27;s the gangster melodrama come of age, truly sorrowful and truly exciting, without the false piety of the films that flourished forty years ago, scaring the delighted hell out of us while cautioning that crime doesn&#x27;t (or, at least, shouldn&#x27;t) pay.<br><br>It still doesn&#x27;t, but the punishments suffered by the members of the Corleone Family aren&#x27;t limited to sudden ambushes on street corners or to the more elaborately choreographed assassinations on thruways. They also include lifelong sentences of ostracism in terrible, bourgeois confinement, of money and power, but of not much more glory than can be obtained by the ability to purchase expensive bedroom suites, the kind that include everything from the rug on the floor to the pictures on the wall with, perhaps, a horrible satin bedspread thrown in.<br><br>Yet The Godfather is not quite that simple. It was Mr. Puzo&#x27;s point, which has been made somehow more ambiguous and more interesting in the film, that the experience of the Corleone Family, as particular as it is, may be the mid-twentieth-century equivalent of the oil and lumber and railroad barons of nineteenth-century America. In the course of the ten years of intra-Mafia gang wars (1945-1955) dramatized by the film, the Corleones are, in fact, inching toward social and financial respectability.<br><br>For the Corleones, the land of opportunity is America the Ugly, in which almost everyone who is not Sicilian or, more narrowly, not a Corleone, is a potential enemy. Mr. Coppola captures this feeling of remoteness through the physical look of place and period, and through the narrative&#x27;s point of view. The Godfather seems to take place entirely inside a huge, smoky, plastic dome, through which the Corleones see our real world only dimly.<br><br>Thus, at the crucial meeting of Mafia families, when the decision is made to take over the hard drug market, one old don argues in favor, saying he would keep the trade confined to blacks&#x97;&#x22;they are animals anyway.&#x22;<br><br>This is all the more terrifying because, within their isolation, there is such a sense of love and honor, no matter how bizarre.<br><br>The film is affecting for many reasons, including the return of Marlon Brando, who has been away only in spirit, as Don Vito Corleone, the magnificent, shrewd old Corleone patriarch. It&#x27;s not a large role, but he is the key to the film, and to the contributions of all of the other performers, so many actors that it is impossible to give everyone his due.<br><br>Some, however, must be cited, especially Al Pacino, as the college- educated son who takes over the family business and becomes, in the process, an actor worthy to have Brando as his father; as well as James Caan, Richard Castellano, Robert Duvall, Al Lettieri, Abe Vigoda, Gianni Russo, Al Martino, and Morgana King. Mr. Coppola has not denied the characters&#x27; Italian heritage (as can be gathered by a quick reading of the cast), and by emphasizing it, he has made a movie that transcends its immediate milieu and genre.<br><br>The Godfather plays havoc with the emotions as the sweet things of life&#x97;marriages, baptisms, family feasts&#x97;become an inextricable part of the background for explicitly depicted murders by shotgun, garrote, machine gun, and booby-trapped automobile. The film is about an empire run from a dark, suburban Tudor palace where people, in siege, eat out of cardboard containers while babies cry and get underfoot. It is also more than a little disturbing to realize that characters, who are so moving one minute, are likely, in the next scene, to be blowing out the brains of a competitor over a white tablecloth. It&#x27;s nothing personal, just their way of doing business as usual. 
A true masterpiece	United States	What can i say about The Godfather that hasn&#x27;t already been said, this film is a masterpiece it is a cinematic landmark, it is in my opinion, better than Goodfellas, Goodfellas is great but this is such a more dramatic film. I love the beginning of this film when the undertaker is asking Vito Corleone for justice, it was such a beautifully shot scene i loved how Marlon Brando portrayed Vito it is one of if not his best performance (Apocalypse Now is his second) of his career. Te Godfather is in my top 10 films of all time and it will always will be no other film can change that. The Godfather will always be remembered as the greatest film of all time and will never be forgotten, i just love this film so much it actually was one of the inspirations that made me want to become a film director and I&#x27;m only 14, it made me actually made me appreciate film and i am glad i watched this even its sequel was amazing and is in my top 20 favorite films of all time but 3 was terrible it should have never had ever been made and i will stick by that as long as i live but i love Francis Ford Coppolas direction of the film it will never be forgotten. 
A masterpiece	Kragujevac	Francis Ford Coppola has outdone himself with The Godfather, probably the greatest movie in cinema history. Marlon Brando shows us his magnificent skills and his way of dominating the scene. The Don&#x27;s relationship with his family is unique and incredibly well depicted. Looking at Brando&#x27;s career, which is frighteningly impressive, to say the least, the role of Don Vito Corleone is without a doubt his best one. To say that Al Pacino was incredible in this movie and the rest of the trilogy would be an understatement. James Caan, in the role of Sonny, comes right after Brando and Pacino&#x27;s stunning performances. Truly a masterpiece, The first part of this epic trilogy will forever be at the very top of my list. 
