Without a doubt one of the best movies of all time	Canada	When I saw that the Shawshank Redemption was #1 on the top 250 movies of all time, I thought &#x22;Yea, I could understand that&#x22;. I don&#x27;t necessarily agree that it&#x27;s absolutely the best, but it is so good that it makes sense that a forum of popular consensus for film rankings would rank it at the top.<br><br>It is the story of Andy Dufresne, played by Tim Robbins and his time at Shawshank Prison. It is a perspective of what it is to be human and to have hope for the future even in the face of insurmountable adversity. <br><br>It&#x27;s funny, because I don&#x27;t really think that any one particular thing stands out as spectacular. The performances are very good, but nothing really noteworthy. The characters all serve the story beautifully, but none of them really stand out from the others. Frank Darabont is great, the shots are exactly what they should be. Almost the entire film is shot at the prison, adding to the feeling of isolation and routine.<br><br>And yet, we are captivated from the outset. Morgan Freeman could read a Sears catalogue and I&#x27;d pay to hear it, his narration breathes life into every scene that it&#x27;s spoken over. The real beauty of this film is it&#x27;s story, mostly about Andy and Red (Robbins and Freeman), but it&#x27;s the way that each character contributes symbiotically to the development of the story that is the absolute mastery. <br><br>Stephen King&#x27;s novella &#x22;Rita Hayworth and the Shawshank Redemption&#x22; was the short story that was used as the basis for the film and it serves as evidence that King is not just a master of horror, but a true literary genius. Sure, he doesn&#x27;t use as many fifty cent words as histories other great masters, but does anyone tell as good a story? King always gives his writing such distinct atmosphere and energy that you can&#x27;t help but get swept away. The Shawshank Redemption is no different. <br><br>If there is a film by which other films should be judged, this is as good as it can get. Powerful, engaging, visceral, despairing, a masterfully woven dialogue of what it means to be human. It&#x27;s one of those journeys of the human spirit that just makes you feel happy to be alive.<br><br>An amazing story translated beautifully to the screen. A masterpiece, 10/10. 
The Shawshank Redemption	Viet Nam	A friend of mine listed &quot;The Shawshank Redemption&quot; as one her all time favorite movies and that brought on my curiosity what Shawshank Redemption was, I even thought it was a typo. The next day I went out and brought home the 10 years anniversary DVD without knowing I was going to spend the most worthwhile 2 and a half hours of my life in front of the TV (a melodrama doesn&#39;t kill, right?)<br><br>I don&#39;t know how to write a good movie review so I guess telling you what I feel about it may do better. I remembered crying a few times, being astounded by the plot twist for a moment or two and ending up sitting alone, inert and all, just because of the once-in-a-lifetime beauty of Shawshank. Just recall the scene in which Andy locked himself in the room and turned the music on, all the cons stood paralyzed on the ground, listening to the magical tune like the song of hope they had never heard before.<br><br>Shawshank is more than a feel good movie, it&#39;s about life-changing experiences, about the endless struggle against life&#39;s harshness and unfairness, about true friends who will stand by you forever... The simple yet hard to convey messages could not be handled more subtly than this.<br><br>Shawshank should have won every Oscar for any categories it was nominated, but it&#39;s all about struggling against unfairness, time&#39;s proved its monumental magnitude.<br><br>Shawshank is a lesson of life that you have to learn in just 150 minutes. 
A movie about an innocent clever man who learns to live within prison walls.	Fort Collins, Colorado	This is Tim Robbins best performance ever. It is a compelling heart warming drama about an innocent man(Andy Dufresbe) who is sent to prison and learns to use his intelligence to make the best of prison life. He meets a mentor in Red(Morgan Freeman) and they build a friendship that is stronger than the walls that surround them. Andy steadies a relationship with the warden that keeps him in the good eyes of the prison. Andy is full of surprises and uses his resourcefulness to not only win the friendships of his fellow prisoners, but also of the prison guards. Both Andy and Red both hold on to their dream of one day enjoying their freedom. They turn their friendship and dreams of freedom into a bond that no prison could ever take away. 
Movie you can see 1000 times	India	I made my account on IMDb Just to Rate this movie. :-) I had heard from someone that Tim Robins has done a great job in this movie. but when i started watching this movie, i could not move my ass for 142 Min.<br><br>its not just about Tim Robins or Morgen Freeman.. its the whole storyline,dialogs and cinematography which insist you to watch this whenever you feel low in your life.<br><br>Movie has some great lines. When Andy(Tim Robins) brake the Jail, Morgon Freeman says &#x22;I have to remind myself that some birds aren&#x27;t meant to be caged. Their feathers are just too bright&#x22; This movie has entertainment, Feelings, Action, Drama a little comedy. In short everything we want to see in a movie.<br><br>I have seen this movie around 100 times and sure will watch more then 10000 times before i die. 1 of the best movies i have ever seen in my life.. Wish i could see that sort of movie again in my life 
Simply Perfect	United Kingdom	Like I did a few years back, you might be hesitating about watching this film. The title didn't appeal to me, and neither did the subject matter, so it was only by chance that I started to watch it.<br><br>I can only say that the film was a revelation for me and has stayed with me ever since. There are so many dark and hopeless films out there which, whilst they leave an impression, leave the wrong one i.e that there is no hope in life. Watch this film and be uplifted and be encouraged by the message...that there is ALWAYS hope....in any situation.<br><br>Please watch this film and the watch it again. It's a great answer to all the cynicism that is out there. 
An excellent film contained within a classic	United States	When I first saw the Shawshank Redemption, I was in a movie theater on a week night at around 11pm. I had gotten out of work from working the evening shift. I was tired and just wanted a little amusement. This was at a time after Shawshank had been released but got little attention. I had heard some Oscar buzz so my curiosity got the better of me. I half reluctantly chose to watch it. That night, I was not prepared to be blown away. I didn&#x27;t see a movie, I was transported by a story. I was instantly transcended into realizing why films should be made to begin with. I wasn&#x27;t just entertained, I was emotionally moved and intellectually bamboozled in the most endearing manner. If this film remains on IMDb&#x27;s number one spot for a long time to come, It&#x27;s well deserves it. To me personally, the Shawshank Redemption is a testament as to why the 90&#x27;s were an interesting decade but more than that, why a film can become an experience and gain instant classic status. There are two simple rules you should follow prior to watching T S R: one, if you haven&#x27;t seen it, don&#x27;t let any one who HAS seen it tell you anything about its plot, Don&#x27;t listen to a word caus they might ruin it for you. Two, make arrangements not to be interrupted when watching the film; no phone calls, no door bells, no other plans. Watch it from beginning to end. You can&#x27;t over hype this film it&#x27;s just that good. What i&#x27;ve written here is just a small fraction of what I can further express by way of praise for the film. Long live The Shawshank Redemption on IMDb ! 
Are you serious??	Birmingham, England	 Sorry folks, but can this film really be (one of) the greatest of all time? Entertaining? Yes. Well acted? Err...yes.  'Life affirming'? No way. Realistic? Don't make me laugh.<br><br>Twenty years or so pass in this film. Does anybody get any older? Apart from the occasional pair of specs, that's it. Not an extra wrinkle to be seen. What happened to the make-up department?<br><br>People get beaten to within an inch of their lives. One death and one wheelchair case, but otherwise just a couple of bruises which disappear rapidly.<br><br>The 'baddies' get their just deserts and we're all supposed to shout 'serve them right' (as we say in England). The 'goodies' live happily ever after, but we knew that would happen within the first ten minutes. The people who think this is a great film probably think Stephen King is a great author. Competent and popular...yes. Great...no!! P.S. Who replaced the poster after...? Was that an oak tree? Maybe leaves are a different shape in America. 
&#x22;I&#x27;m a convicted murderer who provides sound financial planning&#x22;.	United States	Well I guess I&#x27;m a little late to the party as far as writing down a review for this picture. I&#x27;ve seen it a couple of times, but that was before I became a regular contributor to the IMDb. When I first discovered this site a few years ago, &#x22;The Godfather&#x22; was in the Number #1 spot, and since then the films have traded places for first and second, with Shawshank maintaining the top spot most of the time. That puzzled me a bit until I watched it again tonight, and I&#x27;ve come away from the picture with a new found appreciation. My favorite movies tend to be the story of underdogs in some way, shape or form, and my personal Top Ten list includes titles like &#x22;On The Waterfront&#x22;, &#x22;To Kill a Mockingbird&#x22; and &#x22;One Flew Over the Cuckoo&#x27;s Nest&#x22;. I may have to reconsider that list, an infrequent exercise but one I don&#x27;t mind doing every now and then as situations warrant.<br><br>Overall, the film is darn near perfect. I know it&#x27;s pretty clich&#xE9; to state it that way, but when you analyze the dialog, the characters, the directing and the tone of the movie, the picture flows flawlessly, even when it detours into side stories like Brooks Hatlen&#x27;s release and new prisoner Tommy&#x27;s introduction late in the picture. Every set-up, every nuance has some importance that eventually converges to symbolize Andy&#x27;s quest for escape and personal redemption. Remember Brooks feeding Jake for the first time and eventually setting him free when he receives his own pardon? How about Andy playing Mozart into the prison yard while settling back with a smile of contentment on his face. The story transcends one man&#x27;s confinement for a crime he didn&#x27;t commit, and focuses instead on his reaction to circumstances beyond his control. Paul Newman showed us a different way to react to those kinds of conditions in 1967&#x27;s &#x22;Cool Hand Luke&#x22;, but his method was self destructive. Andy Dufresne (Tim Robbins) never loses his ability to keep his eye on the prize, even if it takes him a couple of decades to do so.<br><br>But even more so, you have here the story of Ellis Boyd Redding (Morgan Freeman), a convict who sees Andy as a person, and over time, an inspiration to himself and the rest of the prisoners who call him friend. From Andy, he comes to understand that even as a prisoner, a man can live life on his own terms if he can keep his mind uncluttered by thoughts of desperation and hopelessness. Not bad for a convict who started out believing that &#x27;hope can drive a man insane&#x27;.<br><br>I really can&#x27;t recommend this picture highly enough, both for it&#x27;s masterful story telling and it&#x27;s technical execution. The actors, even those portraying the most minor characters were seemingly born for their roles. They deliver a seamless performance that&#x27;s virtually unmatched by most modern films, in a picture that hits all the right notes with an inspiring message of discipline and perseverance. 
The shortest long movie I've ever seen. Kept me wanting more and more, minute by minute.	Oslo, Norway	 At first, before starting the movie, I thought &quot;Sounds like a typical prison riot and break-out kind of movie&quot;. At the beginning of the movie, my thoughts was even more convincing. A large prison (Which immediately reminded me of the movie &quot;The Last Castle&quot; from 2001), housing people of all sorts, having it's guards, warden and of course, the inmates. The typical inmate; Roughneck, hard on the outside, broken on the inside. And they all claim their innocence, as an internal joke sort of speak.<br><br>It gets to a point where I started comparing it with others. That proved wrong in quite a short while, from the point where a prisoner, framed for murder of his wife and her lover, is being convicted and sentenced to life in prison. His name was Andy Dufresne. In short terms, a straight-up bank employee, excellent with numbers and taxes, which he also uses to benefit within the walls of the prison. His reputation as a numerological genius spreads out, and soon all kinds of people, inmates and guards, are coming to him for financial advice. He builds up a library, he maintains a strict surface. He has his hobbies, to keep his mind busy (as said in the movie). He carves chess pieces out of stone, using an axe as the tool. Seemingly, this is a nice and lucrative hobby, but underneath it all, he has a secret...<br><br>The movie keeps the viewer thrilled and excited, because in every minute, something could happen. The dialog is good, Tim Robbins and Morgan Freeman, both great actors, shows and outstanding play. The crew really did good work on the set, the right camera angles, the light, sounds and so on...it was almost like I could smell the prison!<br><br>A brilliant movie. Not too short, not too long. It's worth every minute watching! My highest recommendation for those who like drama, action and humor. 
Best of all time!!!	India	This is the best movie I have ever seen. In a way I feel I am in a prison of life myself. Restricted to doing certain things. Sometimes I get frustrated and feel as I should runaway to some place where I could feel free. I hope and dream for it sometime. This movie just reminds me of my feelings so much. I love Andy Dufresne most in this movie. Although critics say Tim Robbins didn&#x27;t do enough to express the character but my personal opinion is that he was made for this role.<br><br>I can go on and say more but I said the most important thing which I feel whenever I watch it.<br><br>I am glad to visit IMDb. I never heard of it before. Some 7 years ago I saw it at no.2 in the rankings and decided to watch it immediately. Only other movie which even comes close to this is Citizen Kane. But that is about past and this one is about hope and freedom.<br><br>I give it 11/10. 
For the first time the Movie defeats the Book!	Bangladesh	As an omnivorous reader movies are always second to books to me. I believe....movie can never defeat the book because while reading book we use our own imagination....and movie narrows down the imagination.....it only allows us to see how the director has imagined the book.<br><br>But Believe me...this is not the case of The Shawshank Redemption...which I rate as the best movie I have ever seen.For the first time in history the book(the Stephen King Novella) has been defeated by its movie version.After watching the movie I was crazy about reading the book....I thought wow!the movie is so good...how will be the book!!To tell U frankly,the book is good, but the movie is best.There are some unforgettable scenes in the movie which were not in the book.Some examples are: The scene when Andy locks up the guard and play the opera on the microphone.The narration goes on like..&quot;I didn&#39;t understand a single word that Italian lady was singing...but I tell U..for that single second every soul in the Shawshank prison felt free...&quot;The scene just fill my heart with Andy&#39;s yearn for freedom...I was kinda shocked when I didn&#39;t find it in the original book version.<br><br>I can remember another scene.While Andy creates the prison library and starts listing books sent to prison from charity organizations...a fellow inmate tries to read a name on the book...Alexandre Dumas as &quot;Dumb-Ass&quot;. Andy says....&quot;its not Dumb-ass...its Dumas..and U may like the book..The Count of Monty Cristo...its about a jailbreak.And the category it falls is Fiction&quot; Then Red says..&quot;Why don&#39;t we put it on Educational category?&quot;(Right before Andy listed an engineering handbook as &quot;Educational&quot; category).As Count of Monticristo is one of my favorite books, I was hysteric watching this sophisticated joke.This was also not in the book.<br><br>This DVD is my favorite gift I give my friends. And after they watch it....they always thank me . Like many other IMDb friends commenting on this movie..I would also like to say..&quot;Shawshank Redemption is the best movie I have ever seen in my life&quot;.Thanx to all. 
Very enjoyable, but let's not go overboard, folks	Seattle, Washington	 THE SHAWSHANK REDEMPTION is very enjoyable, features excellent performances, and has won a fanatical following among a lot of people.  I just saw it.  I liked it.  But as for becoming fanatically enthusiastic about it, all I can say is, folks, let's not get carried away...<br><br>The story not only is incredibly *simple* (good man unjustly convicted for horrible crime maintains hope in horrible confinement), but is also incredibly *simplistic* (the Warden and his men are evil goons, the convicts are good).  Complexity is something completely exiled from this story.<br><br>The director, Frank Durabont, offers nothing new in his aesthetic choices -- SHAWSHANK is stock Hollywood filmmaking, especially of the Spielbergian variety ala THE COLOR PURPLE and AMISTAD.  The soundtrack is overpowering in its efforts to imbue the story with &quot;heartwrenching emotion.&quot;  The cinematography is fine in a sort-of standard-issue, &quot;seen it before&quot; way.<br><br>Which begs the question:  Is there anything truly *exceptional* about THE SHAWSHANK REDEMPTION?  Heck yeah -- Morgan Freeman proves, once again, that he is not only a wonderful actor but also one of the most endearing, powerful presences in cinema.  Tim Robbins is fine, along with all of the convicts.<br><br>But overall, I didn't mistake THE SHAWSHANK REDEMPTION for anything particularly new, remarkable, exciting -- in other words, as anything worthy of fanatical enthusiasm.  It's a fine Hollywood film that looks, smells, sounds and feels like your typical fine Hollywood film.  But nothing more. 
What More Can I Say?	United Kingdom	There are only a handful of films that have shaken me to my core and continued to resonate with me for very long after their first viewing. I can happily say that &#x22;The Shawshank Redemption&#x22; has stuck to me since I finished watching it for the first time, and instantly rocketed up my Top 10 Films list. <br><br>Most great films have one or two obvious flaws that can be easily picked out - not so in &#x22;Shawshank&#x22;, at least not to me. The hefty run time doesn&#x27;t put me off because the story and characters are just so well rounded and so easy to return to time and time again. <br><br>&#x22;Shawshank&#x22; is one of those films that I would love to experience for the first time all over again. The thrill of emotions and the highs and lows I felt that first time are incomparable to much else. <br><br>In my opinion, &#x22;Forrest Gump&#x22; was not as deserving of the Best Picture Oscar as this. The timeless feel of a story of friendship in a hopeless place will likely continue to capture generations of people for years to come. 
Brilliant &#x26; Excellent	United Kingdom	By far the best movie ever...<br><br>No Doubt this is the best ever movie you will ever see, It is easily the best movie of my life-time so far.<br><br>Morgan Free is a legend and Rest of the Crew did a marvellous job as well. Well written / narrated and directed movie of all times.<br><br>10 out 10.<br><br>It has been on number one ranking on IMDb and most of the other movie rating websites forever now.<br><br>The best past of the movie is narrated voice by Morgan Freeman.<br><br>The character Andy Dufrain is a very well composed and the Warden character has lot of punch into it.<br><br>Escape from prison was the best it can ever get.<br><br>Marvellous piece of Art. 
