A Potpourri of Vestiges Review: A cinematic magnum opus	India	The Godfather is an extravaganza, nigh flawless, a cinematic magnum opus, ubiquitously acclaimed for its brilliance and for being in a league of its own. The Godfather doesn&#x27;t depict poetic justice but rather portrays the triumph of perspicacious potency over abject vulnerability. The Godfather is known, not for its cogency but for its eloquence. <br><br>The movie being star-studded is decorated with a plethora of supernal performances and it won&#x27;t be a hyperbole that almost every actor gave an Oscar worthy performance. Marlon Brando is exceptionally brilliant in his sterling portrayal of Vito Corleone and so is Al Pacino in his remarkable portrayal of Michael Corleone. The grandeur of Don Vito Corleone ironically lies in his austerity and inexorable equanimity.<br><br>The grandiosity of the movie is such, that even the biggest complement made about it may sound like a picayune remark. The Godfather may most aptly be described as an obituary of humanity, a requiem of mankind, owing to the pervasive violence and the brutality that it portrays in an utmost sanguinary fashion. In a nutshell, the movie has transcended all the limits of mortality only to achieve apotheosis.<br><br>http://www.apotpourriofvestiges.com/ 
Count Me In The Minority	Niagara Region, Ontario, Canada	 First I have to say that it is very difficult to watch this movie for the first time (which I just did) and approach it with an open mind. The glowing reviews it gets everywhere (many of course calling it the best movie ever made) gives one extremely high expectations and the possibility of being easily disappointed. The many parodies of the movie also give it a cult status that makes one think one knows the story even if one has never seen it.<br><br>I thought &quot;The Godfather&quot; was a good movie, but nothing more than that really. I personally wouldn't call it the greatest movie ever made; not even one of the greatest. It was good, worth watching once and I'm glad I've finally seen it, but nothing more.<br><br>The portrayal of mob life in the post-war era seemed realistic enough, and the appropriate atmosphere was set. The opening scenes (revolving around Don Corleone's daughter's wedding) gave me mixed feelings. I thought the whole thing went on too long, but it did demonstrate that Corleone's &quot;business&quot; never ended - he was constantly meeting with various people looking for favours rather than being front and centre at the wedding. Brando, of course, won (and refused to accept) the Oscar for Best Actor for his portrayal of Corleone, but I wasn't actually taken with his performance. First, I really didn't think of him as the Lead Actor. Al Pacino (as Corleone's son Mike) was, I thought, far more important to the story and far more interesting to watch. Brando had - to me - an almost cartoonish aura around him. Over-rated in my view. But Pacino was excellent, and the character of Mike the most interesting in the movie, as he evolves from the returned war hero who wants nothing to do with the family &quot;business&quot; to the eventual &quot;Don.&quot;<br><br>It's not that I thought this was a bad movie. It was quite watchable and for the most part very interesting. I just think I've seen better.<br><br>6/10 
Slightly overrated	Twin Cities	 One thing that's a bit annoying when seeing `The Godfather' is the sense that, as a viewer, you feel you are required to bow down before this film and worship it as movie perfection, or else reveal yourself to be a person of no taste. Well, I can definitely acknowledge that this is a very good movie, but not necessarily great, nor is it on my personal favorites list.<br><br>For starters, while this definitely gives you some great characters and atmosphere, there's really nothing in this movie that you couldn't get from reading the book. In fact, the strength of this film comes from the way the director and actors faithfully bring the novel to life.<br><br>What's best? No question - the acting. Judged on that scale alone, it gets a 10. I cannot disagree with those who state that this combines the best acting performances in American film history. The directing and scriptwriting are also very good, worthy of at least a 9.<br><br>What's not so good? The pacing. As others have noted, this film can be boring at times. Most notably, at least for me, was the time spent showing Mike in Sicily after he shot the cop and the Turk. Other than getting married, it doesn't really show him doing much of anything, nor does it really contribute much to the story. In contrast, the book made this particular sub-plot far more interesting and relevant.<br><br>And that, at heart, is my problem. I've seen the movie and I've read the book. And I far more enjoyed the latter. The book gives all sorts of details the movie skips. For example, in the film, Al Neri is just a guy dressed up as a cop who performs as one of Mike's hit men. In the book, we learn how he went from being a good cop with a bad temper to taking over the role once held by Luca Brasi (another character who is developed far more fully in the book).<br><br>So there you have it. On the one hand, you have to intellectually acknowledge the great talent displayed in the making of this film, but on the other, I must admit it just isn't very satisfying emotionally. These characters seem cold and distant, and I never really cared much for any of them. In that respect, I much more preferred &quot;Goodfellas&quot;. The acting wasn't as good, but the characters were far more engaging and the pacing much more lively. In short, `The Godfather' is sort of like a great, but somber, piece of music, something you can admire but not dance to.<br><br>8/10 
The Greatest Film of All Time !  Period.	United States	This film contains all the elements of a genuine masterpiece. Its attention to detail, history, and tradition. An absolutely wonderful screenplay. Its comparative closeness to the novel and a storyline which became the template for future stories in this genre. As for the performances: there is not one single character flaw in this entire cast. What continues to amaze me about this film more than any other is the fact that not only were the correct actors and actresses chosen for the roles but that they were each chosen at the perfect point in their respective careers. Throughout this film, there is not one actor nor actress who seems &#x22;too old or young for the part&#x22;. Nor does anyone (including an extremely strong Diane Keaton) seem &#x22;out of place&#x22; or &#x22;unconvincing&#x22;. The plot and storyline could not have been better and this is one film that no matter how many times you&#x27;ve seen it, it still continues to amaze, entertain, and (in some ways) inform. Like some of the classics which preceded it, it holds up very well over time and will probably continue to do so. I currently own on VHS &#x22;The Godfather Saga&#x22; (the first 2 movies woven together in chronological order) which is absolutely amazing. It begins with the birth of Vito and ends with the eventual rise of Michael. Although Francis Ford Coppola does not like this version of his epic, I sure wish he would release it on DVD. 
Make More Something Like this...	Latvia	The Godfather is as good as everyone says it is. It&#x27; a near flawless film that achieves so much with so little. What it has is a fantastic script, amazing cast and a director with a vision. No fancy tricks, gimmicks, 3D or any other crap. The Godfather is template on which films should be made but ,sadly, they don&#x27;t do it. <br><br>Just like Jackie Brown, Infernal Affairs, Il Mare, Daisy, Heat, Network, Glory, Dog Day Afternoon, The Bridge on the River Kwai, Manhunter, My Sassy Girl and so on, The Godfather takes it&#x27;s time to develop its characters, allows you to enjoy the performances with slow and steady direction and makes a great use of atmosphere. I love films that allow us to sit down and enjoy a story with very strong characters. I&#x27;ll take The Godfather over Avengers, Dark Knights, Pulp Fictions any day.<br><br>It&#x27;s nearly impossible to name all the great things that are in Godfather. The cast is terrific with some our greatest actors of all time: Al Pacino, Marlon Brando, John Cazale, James Caan, Sterling Hayden, Talia Shire, Robert Duvall and so on. The direction by Francis Ford Coppola s fantastic and his co-written script with Mario Puzo is flawless. And I can keep naming positives all day...<br><br>There really isn&#x27;t much to be said about The Godfather, but I&#x27;m very sad that there isn&#x27;t a lot of films that are like it, especially in Hollywood. I don&#x27;t mean gangster films but films that are slow moving, with strong characters, engaging story and beautiful visuals. South Korea, Japan, China, Hong Kong and Europe are the only places to look for those nowadays... <br><br>The Godfather is a film for an adult. It&#x27;s made for people that can appreciate a great storytelling and all the craftsmanship put into it. I don&#x27;t see it as a gangster movie but as a complex family drama. Godfather should be seen by anyone who considers himself a fan of film and film making. 
Timeless classic...!!!!!	None	Contains no spoiler..!!.<br><br>Firstly i must say what mind blowing performance by Al Pacino and Marlon Brando.<br><br>Even after 40 years this movie doesn&#x27;t get old .Based on novel by <br><br>Mario Puzo&#x27;s,Francis has done beautiful job portraying greatest mob drama <br><br>of all time. Francis ford Coppola&#x27;s &#x27;The Godfather&#x27; is regarded as <br><br>greatest movie of all time.And when i saw it i understood why.<br><br>Everything has been meticulously put together to create an entertaining.captivating. and phenomenal masterpiece!!!!.<br><br>JUST BUY THE MOVIE AND WATCH IT ...!!! 
The Pioneer of All Filmmaking	Leesburg, Florida	The Godfather is one of the most iconic films in cinema history. There are three points in the film that made it stand alone: direction, acting, and writing. <br><br>The direction of this film was great! Frances Fran Coppela really knows how to make a great film. Like Steven Spilberg, Peter Jackson, James Cameron, and so many others, he as list himself as one of the most greatest directors in Hollywood. He&#x27;s my role model. <br><br>The acting was terrible, just kidding! :) The Acting was amazing. Marlon Brando carries the anchor of this movie, but Al Pacino holds it carefully. The cast of this movie was a good example of cast chemistry. Great Cast! <br><br>The Writing was awesome. Coppela knows what he is doing when he is writing a script to a major blockbuster hit. That&#x27;s why he&#x27;s my role model. <br><br>The Godfather is one my favorite films of all time. I would recommend you see this movie. It&#x27;s awesome. 
mafia	Turkey	God Father came to the best mafia movie history owes the beauty of the depth of the event although not touching the films screenwriter. Generally greater than all of the family prominent in Mafia movies keep the subject here treated as. &#xA0;&#xA0;&#xA0;&#xA0;&#xA0;&#xA0;&#xA0;&#xA0;&#xA0; But if the head is feeling lonely (in every sense) family and professional life is no longer the way it was put right. &#xA0;&#xA0;&#xA0;&#xA0;&#xA0;&#xA0;&#xA0;&#xA0; God Father 1 and 2 family integrity while maintaining almost 3 arises where I also ended up in the film. &#xA0;&#xA0;&#xA0;&#xA0;&#xA0;&#xA0;&#xA0;&#xA0; There is also something that should not be forgotten alone; When thick to go through every stage of life between the stay should be limits to what the best deals are to be considered. 
The Finest American Cinema Has To Offer	Kentucky, United States	It has been said so many times that it seems clich&#xE9;, but I wil continue to say it. The Godfather is one of he greatest movies ever made. Words cannot express how well the film combines all the elements a film needs, to be good. The acting is top notch, the cinematography is beautiful, the filming locations and sets are perfect, the sound is great, the music is excellent... I could talk about how great this movie is for hours. Francis Ford Coppola has a clear vision for this movie, and is expertly brought to life.<br><br>The beginning of the film starts out at the wedding of Don Vito Corleone&#x27;s daughter, Connie. At the wedding reception we are introduced to the many of the members of the Corleone crime family, however not all of them are part of the &#x22;family business&#x22;. At the wedding, Vito&#x27;s youngest son, Michael, tells his then girlfriend, Kay, that he was not like his family. Throughout the rest of the film, we see Michael Corleone transform into the very thing he claims he hates. It&#x27;s an excellent example of how character growth should be done.<br><br>From the intriguing beginning where we find Vito Corleone being asked for favors, to the climatic ending where Michael finishes his transformation, The Godfather is a landmark film in American cinema. 
Great movies are not born great, they are made great.	Kolkata, India	I have rated over a 100 movies in IMDb and none of them could get a 10/10 score, but this. I think that perfect score was waiting for me to watch this movie. This movie that has set a benchmark for me to rate other movies, &#x22;Is it The Godfather level good or not ?&#x22;.<br><br>This movie for me is an epitome of perfection, it scores a perfect score in almost all the departments, be it direction, acting, music, screenplay, character development, cinematography etc. I just couldn&#x27;t find a fault with it (and mind you I tried really hard).<br><br>With a blazing canon of actors which include Marlon Brando, Al Pacino, James Caan, Robert Duvall this film pierces right through you and makes a place for itself. Even days after you watch this movie you will find yourself, in your own private moments, speaking out those wonderful lines, trying to copy Vito Corleone or shape your voice like Michael Corleone. In its own mysterious ways the movie will sure remain with you.<br><br>It leaves you wanting more, not because there are questions that remain unanswered, but because this film feels so good that you never want to leave it, leave the streets of New York or the Godfather&#x27;s mansion. <br><br>All in all Francis Ford Coppola has done a remarkable job that, in the least, deserves a standing ovation and an unanimous cheer of &#x22;Bravo!&#x22;. This movie leaves you with an aftertaste of knowing that you have cherished watching an excellent movie. 
A elegiac and well organize American Crime drama, that hits home with what it means to die for your family.	United States	It&#x27;s a bit difficult to find a part, a moment, within the film that doesn&#x27;t showcase great acting, story-telling, and a heart to what it means to have honor and pride. A well deserved film. Brando&#x27;s brilliance is showcased within The Godfather. Al Pacino is a the seed that is placed within the story, who continually grows throughout by the light of his father. Although, some seeds are worth pulling. The undertone of the story is the concept of corruption and the fall of an empire, and a start to a new one. Fracis Ford Coppola&#x27;s masterpiece, an everlasting mark on American Cinema. Definitely a piece of history, and you&#x27;re along for the ride, and experiencing the visceral feeling of that era. 
Review	None	The few &#x22;perfect&#x22; films to ever been released are so perfect in every aspect that each scene almost feels like a masterpiece on its own. In the case of Coppola&#x27;s revolutionary The Godfather, this statement holds especially true. Phenomenal and sheer brilliance in every aspect that cannot be matched by modern &#x22;cinema&#x22;, Coppola&#x27;s The Godfather is cinematic perfection in every aspect of filmmaking. From performances delivered by an astounding ensemble cast, to Nina Rota&#x27;s breathtakingly soaring and epic musical score to Coppola&#x27;s very direction, The Godfather should essentially be viewed as a three hour masterclass on filmmaking for any aspiring filmmakers. So perfect in every aspect and so free of flaws, no film since its time has matched even half the brilliance of The Godfather. 
Masterpiece	Spain	It&#x27;s hard to find a moment in the film that isn&#x27;t great. The Godfather lives up to the term masterpiece. A defining film in the history of cinema, &#x22;The Godfather&#x22; introduced a legendary filmmaker and several acting greats in the telling of an Italian American dynasty undone by the tragic circumstances of their criminal exploits. &#x22;The Godfather&#x22; is highly regarded as the greatest American movie of all-time. No other movie has garnered such praise as this movie has. Undoubtedly, everything has been meticulously put together to create an entertaining, captivating, and phenomenal masterpiece. Starring the best actor of all times (this movie can prove it), Marlon Brando, the rebellious prodigy, who electrified a generation and forever transformed the art of screen acting.<br><br>You can&#x27;t miss this movie. 
Im going to make him an offer he cant refuse.	United States	One of the most critically acclaimed films in all of history, The Godfather shows us inside the world of the mob. But not in a usual way. The main character Don Vito Corleone (Marlon Brando) is the crime lord of the biggest crime family in Ney York, but the film portrays him as an honorable person. He never really does anything that we can look down on him for. He has a strict moral code and always spends him free time with his family. He is an elderly man who has 3 sons and 1 daughter. Michael Corleone (Al Pachino) wants nothing to do with the crime family, Sonny Corleone (James Caan) is a hothead, Fredo Corleone (John Cazale) is a weakling, and Connie Corleone (Talia Shire) is Vito&#x27;s only daughter. The story really begins when Vito refuses the request of local drug lord Virgil Sollozo (Al Lettieri) and as a result, Sollozo attempts to kill Vito. With Vito in the hospital Captain Mark McCluskey (Sterling Hayden) a corrupt police officer working for Sollozo arrests all of Vito&#x27;s bodyguards leaving Vito unprotected. With Sonny as the acting don, Michael goes to visit Vito in the hospital but as he is leaving McCluskey shows up and attempts to arrest Michael but not before Tom Hagen (Robert Duvall) the Corleone&#x27;s lawyer shows up to save Michael. Later after convincing Sonny, Michael stages a meeting with Sollozo and McCluskey in a restaurant but in a life changing moment shoots them booth in the head. From that point on the film showcases the evolution of Michael from the college kid he was before now to a ruthless mobster. This film is one of the most celebrated and critically acclaimed in history, and it&#x27;s easy to see why. The characters here are all great. The acting (which is important because that&#x27;s what makes the memorable characters) is equally great. Brando in fact won an Oscar for his performance as Vito. If you ever come across this movie, stop and watch it. 
The Best Movie of all time	Iran	The Godfather is the greatest film of all time. Films like The Godfather are the reason i have a passion and love for film. In few movies can it be said that a film has defined a genre, but never is that more true than in the case of The Godfather. Since the release of the 1972 epic (which garnered ten Academy Award nominations and was named Best Picture), all &#x22;gangster movies&#x22; have been judged by the standards of this one.<br><br>If The Godfather was only about gun Mafia types, it would never have garnered as many accolades. The characteristic that sets this film apart from so many of its predecessors and successors is its ability to weave the often-disparate layers of story into a cohesive whole. Any of the individual issues explored by The Godfather are strong enough to form the foundation of a movie. Here, however, bolstered by so many complimentary themes, each is given added resonance. The picture is a series of mini-climaxes, all building to the devastating, definitive conclusion.<br><br>Strong performances, solid directing, and a tightly-plotted script all contribute to The Godfather&#x27;s success. Every major character,and more than a few minor ones is molded into a distinct, complex individual.<br><br>The film Begins in the study of Don Vito Corleone (Marlon Brando), the Godfather, who is holding court. It is the wedding of his daughter Connie (Talia Shire), and no Sicilian can refuse a request on that day. So the supplicants come, each wanting something different - revenge, a husband for their daughter, a part in a movie.<br><br>The family has gathered for the event. Michael (Al Pacino), Don Vito&#x27;s youngest son and a second world war hero, is back home in the company of a new girlfriend (Diane Keaton). The two older boys, Sonny (James Caan) and Fredo (John Cazale), are there as well, along with their &#x22;adopted&#x22; brother, Tom Hagen (Robert Duvall), the don&#x27;s right-hand man.<br><br>With the end of the war, the times are changing, and as much as Don Vito seems in control at the wedding, his power is beginning to erode. By the standards of some, his views on the importance of family, loyalty, and respect are antiquated. Even his heir apparent, Sonny, disagrees with his refusal to get into the drug business. Gambling and alcohol are forces of the past and present; narcotics are the future. But Don Vito will not compromise, even when a powerful drug supplier named Sollozzo (Al Lettieri) arrives with promises of high profits for those who back him.<br><br>Don Vito&#x27;s refusal to do business with Sollozzo strikes the first sparks of a war that will last for years and cost many lives. Each of the five major mob families in New York will be gouged by the bloodshed, and a new order will emerge. Betrayals will take place, and the Corleone family will be shaken to its roots by treachery from both within and without.<br><br>The Corleone with the most screen time is Michael (it&#x27;s therefore odd that Al Pacino received a Best Supporting Actor nomination), and his tale, because of its scope and breadth, is marginally dominant. His transformation from &#x22;innocent&#x22; bystander to central manipulator is the stuff of a Shakespearean tragedy. By the end, this man who claimed to be different from the rest of his family has become more ruthless than Don Vito ever was.<br><br>Next to Humphrey Bogart&#x27;s Rick from Casablanca, Oscar winner Marlon Brando&#x27;s Don Vito may be the most imitated character in screen history. The line &#x22;I&#x27;m gonna make him an offer he can&#x27;t refuse&#x22; has attained legendary status, as has the entire performance. With his raspy voice, deliberate movements, and penetrating stare, Brando has created a personae that will be recalled for as long as motion pictures exist.<br><br>Don Vito is a most complicated gangster. In his own words, he is not a killer, and he never mixes business with personal matters. He puts family first (&#x22;A man who doesn&#x27;t spend time with his family can never be a real man&#x22;) and despises displays of weakness. He understands the burden of power, and his wordless sympathy for Michael when he is forced to assume the &#x22;throne&#x22;, is one of The Godfather&#x27;s most revealing moments (about both father and son).<br><br>The Godfather had three Best Supporting Actor nominees, all well-deserved. The first was Pacino (who probably should have been nominated alongside Brando in the Best Actor category). The other two were James Caan and Robert Duvall. In a way, it&#x27;s surprising that Duvall wasn&#x27;t passed over. His presence in The Godfather isn&#x27;t flashy or attention-arresting. Like his character of Tom Hagen, he is steady, reliable, and stays in the background. Not so for Caan&#x27;s Sonny, whose demonstrative and volatile personality can&#x27;t be overlooked.<br><br>Family responsibility. A father&#x27;s legacy. The need to earn respect. The corrupting influence of power. These are some of the ingredients combined in Francis Ford Coppola&#x27;s cinematic blender. They are themes which have intrigued the greatest authors of every medium through the centuries.<br><br>Although the issues presented in The Godfather are universal in scope, the characters and setting are decidedly ethnic. Even to this day, there is an odd romanticism associated with New York&#x27;s Italian crime families. The word &#x22;Mafia&#x22; conjures up images of the sinister and mysterious - scenes of the sort where Luca Brasi meets his fate. Francis Ford Coppola has tapped into this fascination and woven it as yet another element of the many that make his motion picture a compelling experience. 
