Must Not See	United States	This is the worst holiday movie ever made. Don&#x27;t go see this movie, don&#x27;t buy it. forget it happened, i try so hard every day to forget i wasted my life watching this. instead of viewing this movie, turn of your TV and spend time with your family. Get to know them better instead of watching 2 guys talk in a car for 20 minuets. just dot go,just dot go. just dot go ,just dot go . just dot go ,just dot go. why would anyone want to sit and watch this. go watch Rosewater way better film.what every you do don&#x27;t go and see this crappy film. you will hate it i hated it. Had &#x22;Saving Christmas&#x22; run any longer, i wold of died.	1
Another terrible movie from Kirk Cameron	None	This movie was a joke. Don&#x27;t waste your time or money. It&#x27;s a typical pandering movie that will no doubt be forgotten. Cameron claims that Christmas has become too materialistic, yet in a recent article claimed he was a &#x27;sucker&#x27; for all things Christmas. The decorations, the gifts, the trees (which are Pagan by the way), and the shopping. He stated in an article he was a sucker for these things. Pretty much in contrary to his movie. He even once claimed Halloween was stolen by the Pagans from Christians. Kirk Cameron is quite clueless. Even Christmas is Pagan. He&#x27;s a joke and so are his movies. His movies are made just to line his pockets. He And he&#x27;s a bigot to boot.	1
Jesus Clearly Hates Kirk Cameron	United States	In this movie, Kirk Cameron shows us that the best way to get get the world to hate you is to judge and hate people who are different from you. Like Kirk Cameron, the key is to make sure you let everyone know that your judgmental and hateful behavior comes from Jesus and the Bible. Kirk doesn&#x27;t judge and hate because that&#x27;s who he is as a person. No. That is not why. Kirk judges and hates other people because the Bible and Jesus told him that he could behave that way. Where has the old Kirk Cameron of old gone? We all want to know. What made you so cray cray? Why are you so angry at the gays? Why do you hate other religions so much? Why did you ruin your sister, Candace, with your terrible ideas and nutso religious rantings? Oh, dearest Kirk, Bless Your Heart.	1
Worst movie ever. Directed by a disgusting human.	None	The loser Kirk Cameron actually tried to falsify the rating for this movie here and on Rotten Tomatoes.Someone should tell him that lying and cheating are not acceptable Christian values.Someone should also tell him that he&#x27;s celebrating a Pagan holiday. These things he decided are what makes Christmas what it is are the commercialized things that don&#x27;t actually have anything to do with Christmas. It&#x27;s like the guy owns stock in Christmas supplies. If you claim you like this movie, you are a liar. Since lying is a Christian no-no, you&#x27;re going to Hell. Enjoy.Not everyone should be allowed to make movies, especially when they have a political or religious agenda.God likes an honest Atheist more than a lying Christian.	1
Kirk Cameron doesnt speak for all of us	United States	I barely survived the trailer. I have no idea how people paid money to see this movie. As a Christian, I have to beg Christian filmmakers to stop preaching to the converted by writing atheists and agnostics as idiotic, hateful, anti-Christian monsters. Your persecution complex in a country comprised almost entirely of Christians is laughable and only further isolates you from those you hope to convert.Kirk Cameron could have made a movie that&#x27;s actually about family and the true meaning of Christmas. Instead, he wanted to create a polemic against the people he&#x27;s imagined that are trying to prevent him from calling it Christmas. It&#x27;s just sad. Please stop making these terrible films. You&#x27;re embarrassing all of us.	1
Wow	United States	After watching this movie, I may have to gouge my eyeballs out of my head in an attempt to erase the inane images seared into my retinas. Alas, it won&#x27;t help. Why can&#x27;t I give this a zero score? A score of 1 is infinitely higher than zero, and it frankly doesn&#x27;t deserve a 1. A more redeeming film could have been made simply by filming a humpback whale attempting to mate with a Russian submarine, or perhaps watching howler monkeys preen and consume the gnats out of each other&#x27;s hairy backs. But no . . . I was instead subjected to this sermon pontificating about how society has distorted the true meaning of Christmas (well, duh!) but yet after watching this, I found the thought of selfish consumerism to be rather uplifting. Now that is a Christmas miracle!	1
Cameron isnt so much saving Christmas as hes saving the economy for his pay masters	Seattle, WA	Ultimately if Christmas returned to its more simple religious roots (&#x22;reason for the season&#x22;), the vast economic pump that enriches, oh, Koch Industries and everyone else who keeps the religious right in power would be gone and they would, gasp, lose vast sums of money. Even if Christmas became more of an Easter level of commercialism, the effects on the economy would be ruinous. One wonders why Cameron has made such a film when most Christians scream about the commercialism (which technically is keeping most of them in jobs). I suppose Cameron isn&#x27;t so much saving Christmas as he&#x27;s saving the economy for his pay masters.	1
Abhorrent in every way	Silver Spring, Maryland	Every Christmas season one can count on the fact that we will be inundated with TV shows recycling the It&#x27;s A Wonderful Life story, Hallmark Channel will overwhelm us with treacle, and a spate of Christmas-themed films will multiply at the cineplex to raise holiday spirits. I give extremist Christian Kirk Cameron dubious credit for crafting a Christmas-themed film that actually seems to be completely clueless about the meaning of Christmas.It goes without saying that the film resembles a glorified home movie, with horrible writing, worse acting and horrendous production values. Most of the film functions as little more than an unwieldy frame for Cameron to lecture at the audience using the most spurious of &#x22;facts&#x22; and a dubious re-writing of history.The basic &#x22;story&#x22; opens at a family Christmas party where Kirk&#x27;s brother-in-law, Christian (oh the irony!) is all rather overwhelmed and depressed by the materialism of the holiday and feels that the true meaning of Christmas has been lost. This &#x22;attitude&#x22; apparently irritates everyone else, and so Kirk follows Christian to his car to harangue him on his misguided foolishness for the extraordinarily padded 80 minutes running time. Most of this has the camera focused on Cameron&#x27;s perpetually smug smirk while he relentlessly lectures his hapless brother-in-law with outright lies, heavily abridged stories, and general all-around shaming. Interspersed to pad the running time, we take some brief breaks back into the house where completely ridiculous one-note flamboyant caricatures indulge in laughable conversations that no one you know not in a padded cell will ever have with you in your lifetime. The pathetic point though is that during Cameron&#x27;s often incoherent and misleading ramblings, he never once truly addresses any of the issues that Christian had about the materialism of the modern celebrations. Nevertheless, Kirk&#x27;s relentless verbal diarrhea utterly astounds Christian and makes him &#x22;see the light&#x22; and he returns to the party to beg the forgiveness of everyone there for negatively impacting their celebration.Then, Kirk launches into yet another lecture where he urges us to buy the biggest tree, get the richest butter, and max out the credit cards because this is all a part of Christmas and don&#x27;t let anyone tell you otherwise. I myself was raised a Christian and I can assure you that if anyone were to parrot this thought back to any of my religion teachers, their mouth would be washed out with soap. It is a perfectly despicable moral and abysmal coda to an already dreadful &#x22;holiday&#x22; film, which does the unthinkable of surpassing Christmas with the Kranks and Jingle All the Way as the most morally jaded holiday film in history. The film also includes a relentless unfunny blooper reel AND a dance sequence that must be seen to be believed...or better yet don&#x27;t see it at all.	1
Absolutely deserving of the worst rating on this website	United States	I never in my life thought a movie would be deserving of a rating a full point lower than &#x22;Santa Claus Conquers the Martians.&#x22; Call it a Christmas miracle.There are movies that are boring, there are movies that are factually incorrect, and there are movies that exist solely to pander to a specific audience. This movie is deserving of recognition for, incredibly, setting records in all of these categories. Only an amazingly uneducated person who has expended a large amount of effort sticking their head in the sand for a large portion of their existence could possibly rate this movie in the 2-4 range. Anyone above that is simply bearing false witness (against the Bible&#x27;s commands, by the way) at the request of Cameron himself.	1
This Is Too Bad To Be Funny	United States	Anyone who has seen any of Kirk Cameron&#x27;s previous pseudo-films, which generally consist of a sort of Christian apologetic aimed at the grammar school crowd, may think that they know what to expect with this latest offering, and they would be right. Here is Kirk with his usual mugging and winks to the camera as he leads his audience through a tangled and woefully inaccurate lecture on the mythical &#x22;War on Christmas&#x22;. It is just plain awful. I forced myself to watch until the end and it wasn&#x27;t worth it. It is a really pathetic attempt by a pathetic little man to grab a little cash riding on the coattails of Bill O&#x27;Reilly and Fox News. I was hoping at least it would be stupid enough to be funny, but it was just pedantic, dull and annoying. Miss this one and see a real movie.	1
Awful X1000	United States	I never thought a movie could be as bad as Battlefield Earth, until this was released.The movie starts of literally with no plot and from there it is just Kirk and his &#x22;brother&#x22; Christian talking in a car. Kirk, you have not saved Christmas, you have ruined it just like you did film. What you tried to do is make everyone follow what you think Christmas is all about. Literally, this man cherry picks the Bible and creates his own version of the story. You know it amazes me how Kirk finds a&#x22;good way&#x22; to say &#x22;materialism is right&#x22;. How does he go from making such a great movie like &#x22;Fireproof&#x22; to this???? I am sorry as a Christian, but it was just so bad. Again, Please if you know what&#x27;s good for you, don&#x27;t watch this movie, it is that bad.	1
A complete waste of time	London	I love a really strong, beautiful or funny film that lets me, as a Christian, not be embarrassed about my faith. Saving Christmas had me wanting to climb into a hole. From beginning to end, it plays like one of those late night infomercials where the host is far to excited to be human. This film is nothing but a vanity vehicle for Kirk Cameron, it&#x27;s self congratulatory and he comes off like a 12 year old locked in a toy store over night. His performance is a wreck, his exaggerated enthusiasm is cringe-worthy and at any minute you expect him to giggle and shout &#x22;Hey Ma! I&#x27;m making my own movie.&#x22; This is less a movie about Christmas, Jesus, or anything else as much as it is about Kirk Cameron begging you to look at him as he twirls.	1
Worse than Ebola, Aids, The Black Plague, 9/11 and Bucky Larson combined.	North Pole	Prior to viewing this film I was a devout Christian and Pastor. However this film broke my spirit and has caused me to not only reject my faith in God but in humanity all together.Each scene is worse than the last as Kirk Cameron uses the first portion of the film gathering wood, nails and a microphone to construct what will be int he second half, The worlds largest soap box.As a former pastor I once sat for a 5 hour sermon and still think this film is more preaching than that.When the film ended two thoughts crossed my mind, One was the strangely absent &#x27;That&#x27;s All Folks&#x22; Looney Toones ending and the second was a written apology and or refund of my money.Don&#x27;t watch this film, ever, don&#x27;t subject your family, friends or even stray animals to this picture.Kirk may be trying to silence the critics but the reality is this movie is so horrid so void of content and character that it may induce suicide in the depressed.In summation a 0 ratings needs to exist on IMDb because giving this long winded rambling non non sequitur a 1 is giving it too many stars.	1
Merry Kirkmas	None	Kirk, you set new standards for just how low the bar can be. I don&#x27;t know what genre this movie would fit int but it somehow is humorous and terrifying at the same time. I&#x27;m not sure if it was satire or you really believe in your own bu11sh*t. The message of this movie was so forced and there were more logical fallacies than I could juggle with. I almost recommend others to watch it because the entirety of FAIL this film contains is too much to believe. The record score of 1.5 stars should tell you something, Mr. Cameron. All hope isn&#x27;t lost though, you may make a 1 star film that would make this one look better. Having less arbitrary music, better acting, and improved cinematography over all might be a good start.	1
Kirk Cameron - Hero in the 80s, Pathetic at Best Now	USA	This movie should have never been made, it&#x27;s a farce at best and an insult to the viewer&#x27;s intelligence at best. I used to admire Kirk Cameron when I was growing up in the 1980s, he was a cute star then. It is so sad to see that he is now a fanatical, bible thumping, proselytizing has-been. I&#x27;m sure if you are also a fanatical extremist Christian, this movie will surely appeal to you, and you can share in Cameron&#x27;s sad, lonely little world of fanaticism. However, if you are a non-extremist Christian, or anyone else in the world, you will find this movie to be offensive in at least one or more ways.This movie surely belongs at the bottom of the bottom 100 list. Mr. Cameron, please retire.	1
Everything that needs to be said about this movie has already been said.	United States	When a movie makes the bottom of the IMDb worst movie list, I have to see it in the theater if at all possible. For weeks now, I read the bad reviews, read Cameron&#x27;s plea for fans to up his ratings online, and anticipated this getting cam&#x27;d so I wouldn&#x27;t have to pay good money to see it. Unfortunately, it&#x27;s not even good enough for someone to cam and upload online.The problem is that this movie never should have been released in theaters; it should have been straight to video. More accurately, it never should have been released at all. All this film equates to is a big stroke of Cameron&#x27;s ego. He is clearly in love with himself, and I&#x27;m sure every review, good or bad, makes him feel all the more confident. It&#x27;s sad, but true. Or, maybe he was just trying to do something nice for his family. If you have the money, why not make a movie with your sister so she can feel like a star too. Unfortunately, she probably feels more shame than good.There is no doubt here. This is a bad movie. Yes, I might even say it&#x27;s the worst movie ever. I&#x27;ve never walked out on a movie before, and that record still holds. However, the thought passed my mind several times while watching. I now feel ashamed of myself that I did not. The bastardization of Christianity that this movie inflicts upon the viewer is almost unbearable. I&#x27;m sad to know that I supported Mr. Cameron by paying to see this film. However, I am happy to see this filth voted into oblivion.	1
How wretchedly horrible and insulting	Broken Arrow, Oklahoma	This has to be one of the most insulting and wretched movies of all time. It doesn&#x27;t even look like anyone bothered to edit it competently, much less write a decent script.Don&#x27;t bother with this unless you need to educate yourself on the latest crap out of Kirk Cameron&#x27;s pie hole.Just total garbage. I&#x27;d personally like to know what exactly happened to this kid back in the 90s to cause this mess.Please. If you see this film then give it a review here. People need to be warned fairly about the disgusting nature of it as well as the incompetent work done in it.	1
You have to see this to believe it, I mean it!	Maryland, United States	I&#x27;m kinda in charge of my church&#x27;s youth group. It&#x27;s because I&#x27;m the only guy in their 20s that shows up for church. I don&#x27;t know how we ended up seeing this movie because none of us wanted to see this. The teens didn&#x27;t want to see some religious movie, my pastor didn&#x27;t want to see this because she loathes Kirk Cameron, and I didn&#x27;t want to see it because I wanted to see a good movie. Apparently one of the parents insisted we see a documentary about making Christmas more about Jesus and less about commercialism.Well the jokes on them because shockingly this movie is all about justifying the commercialism of Christmas.I was seriously not expecting that. THis movie throws so much BS at you that it&#x27;s pretty worrying. It&#x27;s also really funny. I think I was the only person who enjoyed this movie. I was hoping that Kirk would have a seeing where he&#x27;s just says insane things like his infamous interview on evolution.This whole movie is insane. I don&#x27;t think anyone was expecting it to be like this with the random dance scenes, the stereotyped black guy, the stereotypical atheist, and everything else.And now here is an example of Cameron&#x27;s crazy points about Christmas: -The Christmas tree is not Pagen, it is because Adam and Eve stole from the tree of knowledge and to make up for the original sin, Jesus returned the fruit which was part of man by hanging himself on a cross, which is made of wood which naturally comes from a tree. So trees are really crosses and the Christmas tree is a cross.I did not make that up, that is seriously an argument he makes.And the whole movie is so insane that you have to see it to believe it. I don&#x27;t think this movie will harm society because I think most Christians who make a big deal about the &#x22;War on Christmas&#x22; will be horrified by this and those who actually buy into it were probably lost causes. But if you want to see a man who clearly needs to be institutionalized just be gloriously and honestly insane, then watch this movie. I haven&#x27;t seen anything this funny since Twilight Breaking Dawn Part II.	1
Transparent drivel	Norway	This is nothing more than a poorly hidden attempt of Cameron to do some preaching and to his fellow Christians by the looks if it. And he does so with the total lack of historical and factual knowledge he is so well known for. This disaster is a mess from the sound, cam job to the post editing if any was done at all. I won&#x27;t even mention the acting because there was none. The logic behind his argument was best illustrated by Penny Walker; Arizona Republic! &#x22;How do you prove a horse is an animal? Because I like Sweden. That&#x27;s the style of absurd logic that happens in &#x22;Kirk Cameron&#x27;s Saving Christmas&#x22;.I turned the damn thing off half way. I simply couldn&#x27;t stomach any more of his ramblings. Given Cameron&#x27;s track record, I knew it was going to be bad, but thus he reached a new low on his decent in to obscurity. I spent some time thinking of something positive to say about this laughable dung pile, and I came up with one thing. It didn&#x27;t have Ray Comfort in it.	1
Excreatable crap and false propaganda.	New Zealand	Kirk Cameron tries to &#x27;revise&#x27; history to make Christmas have always been about Christianity. Sadly any forth grader with access to a library, or even just Google, can discover this isn&#x27;t true.Cameron uses terrible acting and transparently obvious preachy propaganda to make what surely must be the most banal Christian movie ever.I&#x27;d rather have my internal organs liquefied by flesh eating viruses, than have to watch another second of this crap.It it was JUST boring as hell, or JUST transparent propaganda, or JUST full of &#x27;lies that are OK to tell because it&#x27;s in service of my religion&#x27;, then would be a bad, yet forgettable religious infomercial... I mean movie. But it&#x27;s all that and worse, so I&#x27;m left wishing there was a way to edit out my memory of this abysmal turd of a movie.Ugggh.	1
Cautionary Tale	Los Angeles	Aside from the fact that Mr. Cameron is the dean of the Tool Academy; this is so unwatchable that if Kubric was alive, he would replace all the ultra-violent movies in A Clockwork Orange with this turd and he wouldn&#x27;t even have to induce a gag reflex . . . that much is conveniently built-in. Plot? Acting? This disaster leaves so much to be desired that he should pray for forgiveness for the rest of his days. I do not think Jesus himself would be able to forgive this offensive attempt at art. Is it not enough to embarrass yourself on CNN and YouTube with the bible thumping? He has the temerity to ask people to spend their hard earned money, and precious time enduring this drivel. The rock is ready for you when you&#x27;re ready to crawl back under it.	1
Should have been called Murdering Christmas	Massachusetts	Forget the laughably shoddy production value, the overt preaching, and Kirk Cameron&#x27;s epic social media temper tantrum when the film was critically panned. All you need to know is that Cameron&#x27;s message about Christmas is the opposite of what one would expect from a movie called &#x22;Saving Christmas.&#x22;See, that whole &#x22;saving Christmas&#x22; storyline has been played out in kids&#x27; movies and Hallmark specials over and over again, and it&#x27;s always about stripping away the commercialism and materialism and getting back into friends and family.Kirk does the exact opposite in this film: He CELEBRATES and ENCOURAGES rabid commercialism. And worst of all, he even attempts to justify his materialism -- his greed and narcissism -- by claiming that&#x27;s the good proper Christian thing to do.So if not from rabid consumerism, what is Kirk Cameron trying to save Christmas from? From people celebrating, or even acknowledging the existence of, other holidays besides Christmas, from non-Christians celebrating Christmas, and from Christians celebrating Christmas any other way than the way Kirk Cameron believes you should.In short, this is eighty minutes of Kirk Cameron trying to cram one hundred pounds of his self-absorbed discount-salvation bull**** into a one-pound bag, slap &#x22;Christmas Spirit&#x22; on it with a label maker, and hopelessly attempt to cram it down your throat.Unless you are a raving fascist fundamentalist who only hasn&#x27;t watched this movie because you are afraid of what will happen if you turn your 24/7 Fox News feed off, this movie is guaranteed to make you very angry. It does to Christmas the exact opposite of what the title promises: It delivers unto Christ this biggest black eye in our lifetime.	1
Ho Ho No!	United States	I have never been religious. In fact, the only times I ever step in a church are for weddings and while on vacation in Europe. So, I did not go into Saving Christmas with much of an open mind. But I gave it a chance. A small chance. It was about the time when St. Nick commits murder that I turned it off. Just stay away from this movie. The acting is bad. The only people who might like this movie are death row prisoners on their day of execution, because Saving Christmas makes an hour feel like an eternity. Like I said, I am not the kind of person this movie was made for. But I&#x27;m certain that even if I believed in Jesus and what-not, I would still find this movie awful. Kirk Cameron should be ashamed and embarrassed, but he is not, which makes him guilty of the sin of pride.	1
