It was fine.	None	More of a sterilized sermon than a movie. I thought the movie was paced a little slow but in the end the movie was enjoyable and had a since of humor. I&#x27;m sure it was polarizing for many and that many that have panned it never saw it. My wife and I both enjoyed the movie and it gave a great platform for extensive discussion. I especially enjoyed the refocus on the Christmas Tree. It gave me no new information but a little different perspective on the tree and its importance. The movie has no real plot but is rather one group&#x27;s (obviously Kirk didn&#x27;t make this film by himself) explanation for the significance and enjoyment of Christmas. I saw no real reason to involve the story of St. Nicholas with the Lord of the Rings, but it was more history of the church than most people ever get.	8
Very worth watching	Chesapeake, VA	Overall, I thought it was a great Christian movie. The message of celebrating Christmas instead of getting so wrapped up in the arguments over certain details of the celebration I think was lost on a lot of people, given how many people rated it low based on particular details of his description of the holiday. There were parts of it that I felt he was &#x22;reaching with&#x22; as well (particularly his explanation of the Christmas tree) but a lot of other thoughts that were very thought provoking to me (his take on the birth of). Besides, I personally love hearing other people&#x27;s opinions and beliefs. =)) To me, the worst parts of the movie were the &#x22;lecture style&#x22; intro and the dance scene in it...but again, the movie itself I thought was very thoughtful and thought provoking, and I personally LOVED the &#x22;Celebrate Christmas&#x22; message it contained. The script was well written and the acting surpassed most independent films (which people tend to forget it was).Basically, if you&#x27;re not the type of person to say &#x22;It&#x27;s Kirk Cameron, I&#x27;m going to hate it&#x22;, then it&#x27;s more than worth watching, if you are that type of person, then definitely don&#x27;t waste your time. It&#x27;s someone of strong faith using his artistic ability to spread his beliefs to anyone who wants to hear his message, and based on that fact I give it a 10. It&#x27;s not a message that&#x27;s popular in our culture, and especially not popular in secular Hollywood.	10
I condemn you to hell!	Ireland	Saving Christmas is a fabulous movie that we&#x27;ll all be watching for years to come. This movie celebrates Christmas in all it&#x27;s glory and tells us what it&#x27;s really about, Jesus Christ. &#x22;I condemn you to hell!!!&#x22;, I roared at the devil-worshipers who were shaking their heads after the film ended. This movie truly is &#x22;Saving Christmas&#x22; before all the anti-Christs finally fill our joyous hearts with Illuminati! I&#x27;m speaking to the last of us saviors; grab your cross, get your torches fired up, bring your pitchforks as we will reign our terror on all the no-good doers that walk on our planet! Jesus Christ shall ooze from all of your souls!!! WE CONDEMN YOU ALL TO HELL!!!!!!Thank you, 10/10.	10
Best movie ever!	Sweden	This movie is a masterpiece from the story to the acting is 10/10 I don&#x27;t think anything could have made this movie better. The special effects where amazing i have never seen anything that good in my hole life. Darren Doane where the perfect choice for directing this movie he knew exactly how this movie should be and he delivered. The only negative about the movie was that it was to short.Story 10/10 Acting 10/10 directing 10/10 special effects 10/10 I would probably rank it #3 for the best movie ever made where lord of the rings is number #1 personallywatch it now!!!	10
Saved My Christmas	None	This movie enlightened me, made me laugh and gave me food for thought. Isn&#x27;t that what Kirk was trying to accomplish? For those of you that gave it a negative review - shame on you. You obviously missed the meaning of this movie. For those of you that didn&#x27;t see it...should. It brought together all the things we think of at Christmas and gave them actual meaning - and how Christ relates to each one. I can&#x27;t wait to see this come out on DVD so that I can share it with those that missed the opportunity to see it with me. This movie also didn&#x27;t give the viewer too much to process - just enough to get the meaning across. It&#x27;s up to me (and you) to delve into God&#x27;s word to learn more to find out more about each of the story lines in this movie. I want to know more...and that is what Kirk Cameron was trying to get us to do. #SavingChristmas #KirkCameron #KirkSavedMyChristmas	10
A History of Christmas Tradition	Canyon Lake, Texas	We wanted to see this movie because we read on the synopsis that it was a Christian explanation of Christmas traditions. As Christians who are a little overwhelmed by the commercialization of the celebration of the birth of Christ, we appreciated the way this movie made us appreciate even the more secular appearing traditions. It all comes down to one&#x27;s posture of heart, whether it&#x27;s one&#x27;s Christmas celebrations or one&#x27;s attitude toward this film. If you just want to escape and be entertained, choose another movie, this is not that type of entertainment. But if you are looking to reconnect with beloved traditions in a more meaningful way, this movie will give you something to think about. We loved it!	10
Not a bad movie -Unfortunately a link to this page was posted....	None	Funny at times. Has a good message. Makes you feel good at the end, restore your faith in humanity. I&#x27;m not too sure about his friend, sketchyI think the idea is correct about putting Christ back in Christmas. I hope it makes a lot of money. Nothing wrong with a GOOD Christmas movie. It&#x27;s a lot better than &#x22;Bad Santa&#x22; or some of the other terrible Christmas movies I will not let my kids watch. The movie seemed a bit long, and the plot was a bit predictable except for the end (I wont spoil it for you) Unfortunately a link to this page was posted on a homosexual website, and they requested that people down vote the movie, so the results we are seeing may be inaccurate :(	9
one star reviews likely not real reviews, activists weighing in on Jesus himself:)	None	Anyone that isn&#x27;t a religion despiser has to be honest; this movie rocks. It was heartwarming adorable and really really fun. Yes the plot was limited, but hey, so are the plots of many very enjoyable entertaining flicks:) It had enough plot to be interesting and enough endearing holiday garb and jingle to boost my holiday season. I am amazed at the emotion ....and sheer LENGTH (college term paper length) of some of the very inaccurate wildly neg reviews. These folks obviously are &#x27;activisting&#x27; not &#x27;movie reviewing&#x27; or they wouldn&#x27;t be so emotional; but rather they would be doing a shorter &#x27;matter of fact&#x27; review,....like is normal:)I saw Saving Christmas at the &#x27;Egyptian&#x27; theater at Arundel Mills mall on Dec 15th. My son went with my husband and I. It was ridiculous that the movie was so hard to find. We drove 30 min to see it:)...because we heard it was really good and represented our heart on Christmas. Regardless of ones view on that matter, there is nothing to despise and attack about this light hearted beautiful film. It is great,exceptional acting (which surprised me). It was really well written and put together from start to finish. Anybody badly bashing this film in an unusually lengthy manner,is simply on a lib activist rant and should be refraining from showing that ulterior nonprofessional motive so obviously:) Mr. Cameron came up with a very good quality film with a well chosen cast. It was a highlight of our Christmas this year and it deserved to be in more theaters! I hope he initiates another film for next Christmas, I would be in the front of the line going in:)	10
What did everybody think this movie was about?	United States	I went with my niece because she wanted to and I was not expecting much. the movie had a nice message, there was no gang wars, no cussing for no reason, no girls dry humping anything in sight. If you want to take a younger person to a move and not have to worry about sex scenes, murders, drug use or exploding cars. I do not always want to go see an over acted movie, with over the top special effects, sometime I think they have some special effect just to show off how great they are, and over directed. Some time you just want to go to a movie with a cheerful message and as a religious person I liked the message as did my niece. I do not need a movie that is as much about evil as it is about good to enjoy myself.	10
Point of View	United States	Really, why are so many atheists even rating this movie? Did they really watch it? Why would they? I can see why they would hate it, and I don&#x27;t blame them. It&#x27;s totally opposite their point of view.I gave it a ten rating, not because I&#x27;m trying to help out Kirk Cameron, although I have to admit it&#x27;s not the greatest movie I&#x27;ve ever seen. I can&#x27;t even say I agree with everything in the movie. But - and this is important to me when it comes to movies - it made me think. It made me want to go home and do some research. And I found that there are other sources out there who back up what the movie says. Also, I did think the movie was funny. Maybe I&#x27;m just easily amused.	10
Funny and Faith based movie	United States	This movie is extraordinarily different than all other Christmas movies. It&#x27;s sometimes hilarious and serious about faith other times. I&#x27;ve been ready for years for someone to take Hollywood head on with the truth about the true meaning of Christmas! If you&#x27;re looking to have a good time with your kids and let them watch something that will leave them with a better curiosity of what Christmas means, then check this movie out at your local theater. Don&#x27;t get me wrong, the movie won&#x27;t win an Oscar, but you&#x27;ll have a smile on your face when you leave the theater. Kirk Cameron takes his faith and Christmas very serious and has been trying to get a movie like this made for years. Like most of us, I love all the old classic Christmas movies and will for the rest of my life. But, there&#x27;s not many of them that address the truth behind what Christmas is all about. I recommend this movie to all families!	8
Great Movie	USA	This movie is great and it has a great message. It is everything I expected it to be while explaining in a cue and funny way what Christmas is really about! While it is not a great cinematic production it was never designed to be. It is based around the belief that people need to realize that Christmas is a great celebration and worship of the greatest event in history!! When it comes out on video I hope the tide will turn and more people will accept it for the simple movie of truth it was designed to be. I do not always agree with Kirk Cameron but this time he has the message of Christmas in a great context. Everyone should at least watch this movie one time, Jesus is the reason for the season.	10
To Carnal Christian and to The Gospel rejecting population need to learn Biblical History	United States	This is my updated review on Kirk Cameron&#x27;s Saving Christmas, and it has been submitted to IMDb for review.. Will it be on IMDb? I would say more of a no, than a yes.(1) Book of Genesis and the Origins of trees (God created the trees) and winter solstice (astronomy of the planets aligning with this particular solar system), and their actual meanings; (2) Book of Exodus - specifically about the Tabernacle and what inside of the Structure, and their references; (3) Saint Nick (known as Santa Clause) and that he was part of the Council of Nicea, that he was also born-again, and help others with gifts. (4) Books of the Gospels (which are technically Old Testament) - Tree is the main central theme, in that Christ is God Incarnate (Fully Man and Fully God); He (Christ/Messiah) was born in swaddling (burial) clothes, that He was meant to die. He couldn&#x27;t sin at all, and He was tested at all points, and still did not sin at all; He (Christ/Messiah) was beaten, Crucified on a Roman built Cross, died, covered in swaddling clothes, then buried for 3 days and 3 nights, and rose again (Resurrected). Why did He (Jesus Christ/Yeshua Messiah) do this? He did it for you, for every man, woman, and child is born a sinner because of Adam in the book of Genesis sinned, and we inherited this sin nature. This is what the movie is really about! It&#x27;s about the Gospel, that Christ died for sinners! People who say &#x27;Christmas is pagan&#x27;, need to watch this movie, and then go back to the Origins, from the book of Genesis, whether&#x27;s it&#x27;s in your Torah or Tanak, New Testament, Gospels, History, Apostolic Writings, and/or Bible. This movie is really a commentary of Biblical History, and that you can still receive Salvation for your sins, and that you can be a child of God through Christ&#x27;s Blood Sacrifice (The Perfect Lamb of God, Old Covenant typology).The media in news and movie reviewers view &#x22;evil is good&#x22;, and &#x22;good is evil&#x22;, and view this as the &#x22;worst movie ever&#x22; (in reference to Saving Christmas).. Really, it&#x27;s the worst movie ever? Are you sure? What about James Cameron&#x27;s Titanic, which really wasn&#x27;t about the Titanic? I mean, you see the Titanic here and their, but it&#x27;s about adultery, if you understand the term and it&#x27;s origins: engagement, and it really means = to be married.What about Michael Bay&#x27;s Transformers (2007)? You get the Transformers with very few lines to them (robot characters), and the lines are given to an actor and an actress, who are unknown until this movie came out. I felt like I was watching a cross-between Bill &#x26; Ted&#x27;s Excellent Adventure and Clueless (which I can&#x27;t recommend either movie). I would hear from people in my area, that it was &#x22;a good movie!&#x22; and &#x22;Megan Fox is hot!&#x22;, and in translation: &#x22;Good special effects, hot girl, and no substance to the story at all.&#x22; Is their such a thing called movie plagiarism? It would apply to this particular movie!What about the recent Noah by Darren Aronofsky? This is behind the grade F-, and it fact, this is a very heretical version of Noah. It only had about 5 good points to the mass amount of liberties and rejects the Biblical History altogether..What did these three do, along with other movies who fall hard in Hermeneutical and Exegetical (Science and Art of Interpretation, letting the writer(s) speak for themselves, and having good application to what&#x27;s being written/said) standards? In the fiction historical background, and non-fiction (literal history) accounts who fail to follow manuscripts in history, and it fact, people get praised to doing something that receives an F-, and get ridiculed for A+ when it comes to movies, documentaries, and commentaries. It&#x27;s really: &#x22;Let&#x27;s apply A+ to Ivy Leagues with their buy-out program&#x22; and &#x22;Let&#x27;s apply F- to who understand True Interpretation of things.&#x22;In today&#x27;s society and since the 1920s-1930s, the view is: &#x22;reject it: if it convicts us, you need to a full 180 in your so-called life style (it&#x27;s really a death-style), corrects these forms of so-called theologians views (nazists, fascist, communists, socialists = aka liberal and moderates), has True Supernatural substance to it, and it&#x27;s True Historical accounts, it doesn&#x27;t do my homework (research) for me&#x22; which Saving Christmas actually does. Yep, you get to your homework (research) on this Bible Commentary, Bible History, and actually documentational History (do Origin Source Research)..While the majority of society (not just in North America) embrace superficiality (i.e. Transformers, Titanic, Noah), and reject Hermeneutical and Exegetical standards, and perform Eisegesis (let&#x27;s take a mass amount of liberties, and give a folklore, myths, add deceptions here and their), and it does my homework (research) for me. It&#x27;s: &#x22;Oh, I don&#x27;t have to my homework for me! Hooray! I can be lazy!&#x22; Come on! Push yourself! Overwhelm your selfishness! Do the homework! Stop being lazy!This is a great example, to show, that Kirk Cameron wants to speak the majority who are in the two world-views: (a) Laodicean society (In the Bible, in the New Testament, read the book of Revelation, Chapter 3). (b) Corinthian society (In the Bible, in the New Testament, read the book of 1st and 2nd Corinthians).	10
Great Content  Great Quotes... Santas the man!	None	I saw this movie, with a bunch of friends &#x26; family at a Regal theater. Although it was a different style than what I was expecting, in that there was a lot of narration, the overall content was great! Basically, it was a celebration of the meaning of Christmas and it had funny one-liners like...&#x22;Santa&#x27;s the Man!&#x22; Plus, I really enjoyed the scene with the two guys who were rapping behind the mugs were hilarious! Lol #GoodTimes The actual filming too had some nice effects that flowed well with the story-line. I bet most of the people writing reviews are &#x22;haters&#x22; who didn&#x27;t even see it! #YouKnowItsTrue #BahHumbug Great Job to those who made this! Great Information! Merry Christmas!	10
One Of The Greatest Movies Of All Time	United States	I viewed this movie the first week it came out, and it is simply a wonderful movie. Every movie that Kirk Cameron does is great. All freedom loving, patriotic Americans will love this movie. Do not be fooled by all the bad reviews by all the lefty, Obama loving, liberals putting down this wonderful movie. None of the people who have given this movie a bad rating have even seen this movie. If they had actually viewed the movie, they too would love it. The movie itself concerns Kirk Cameron speaking to his brother-in-law about the joys of Christmas and the joys of loving, close knit families. This is another reason all the loony left hates this movie, they hate anything to do with intact, man-woman, families or God. Do yourself a favor and go see this movie.	10
Definitely not a 10, nor a 1	USA	This movie is not a &#x27;10&#x27;, and not a &#x27;1&#x27;, either. Why are the vast majority of the votes either 1&#x27;s or 10&#x27;s, then? Because people are voting their worldview, instead of voting on a movie.It is hard to categorize this film - if I had to categorize it, I would call it a Christian docudrama, or Christian Christmas movie. In my opinion, an hour long television program would have been a better format for this effort, than an hour and twenty minute theatrical release.It is a low-budget digital independent film, and the production values reflect that. It sets out to present a conservative Christian point of view, and does that openly and unapologetically. There was nothing that I found intolerant or mean spirited, and it seemed rather to espouse traditional Christian values of Christmas, such as &#x22;Peace on Earth, Goodwill toward All&#x22; - although that line does not occur in the film.The bottom line is: if you are a conservative Christian, then you will probably enjoy this movie or at least find it interesting. The further your worldview departs from that, the less enjoyable you will likely find it.	6
Semi-documentary--Meant to Inform More Than Entertain	United States	I like Kirk Cameron&#x27;s stuff. Let me put that out there. I understand where he is coming from and tend to enjoy it. &#x22;Saving Christmas&#x22; was informative but draggy. The format--two guys speaking together in a parked car on a driveway--tends to make the movie narrative and leads to an extremely slow pace. With a little livelier pacing and some editing (to remove the pregnant pauses), the message could have been presented in 45 minutes. I did not go into this movie thinking it would be a comedy, so I wasn&#x27;t disappointed. However, the comic relief presented was a little strained and contrived.There is, actually, very little acting. The descriptive parts frame a number of vignettes that illustrate what is being discussed. In between different themes, a party is going on. Some of the party sequences made little sense. There is one sequence where two coworkers are talking behind coffee cups (presumably to keep from being seen on video discussing things at work) which has absolutely nothing to do with moving the story and, mercifully, is never addressed again until the out-takes.That having been said, I came away with some information that I did not know or had never thought about before seeing the movie. I believe the message should be heard by Christians and, thankfully, it is aimed directly at Christians. I don&#x27;t feel like I wasted my time in the movie, but I feel like it could have been presented more evenly. My suggestion is to support Mr. Cameron by seeing his other stuff and borrowing this movie from the Church Library.	3
Finally, a REAL Christmas movie	None	A wonderful and fun spirited NON Hollywood movie about keeping Christ in Christmas with NO Hollywood liberal agenda or spin involved. Must see for Christians. No cursing, no questioning God or religion. It was really refreshing when everything that seems to ooze out of Hollywood (including the actors themselves) these days, is either bashing the foundations of this great country or bashing Christians. Kirk Cameron tackles the traditions and questions about Christmas and it&#x27;s commercialization head on and with no apologies. If you are a Christian and it is your favorite Holiday as it is mine, Saving Christmas is a must see.	10
Awesome Movie	Minneapolis, MN USA	I saw the movie, and it was great. Interesting, funny, enlightening - I loved it. On Reddit I saw that readers are calling on &#x22;all atheists&#x22; to give this movie a 1 Star rating - even if they haven&#x27;t seen it. Don&#x27;t believe the low rating its been getting. Very misleading. Kirk does an excellent job of putting together a family friendly film. It&#x27;s not too preachy - it&#x27;s actually anything but that. The characters are endearing. The jokes come at all the perfect times. My family got the biggest kick out of some of the humor. Way better than 99% of the garbage Hollywood puts out these days. I guarantee anyone rating it low has not actually seen it, and are simply haters.	10
Educational movie with a touch of family comedy	United States	Made me think more about the reasons for celebrating Christmas. Helps me to see that I can focus on the true meaning of Christmas while partaking in the celebrations of the season. The main character named Christian did an excellent job and was enjoyable to watch. The others in the cast provided the right amount of lighthearted humor. There was a good balance of scenes between Christian and Kirk Cameron and the main party. Kirk Cameron is known for producing great movies and people have a certain expectation from his films. This film seems to be marketed as a full action comedy which sets expectations different than what the movie actually is. I liked it. Just know it has more of an educational approach with light humor.	7
Perfect film to smash the humbugs	United States	People who are sick of the commercialization of Christmas and are ready to give it all up will appreciate this movie. People who are not familiar with Christianity will not get this movie or think it&#x27;s bogus. However anyone familiar with the history of the church will recognize the story of Nicolas of Myrna and his role in the Council of Nicea. The recounting of the events of the original St. Nick will put a new spin on the Ho Ho Ho! This was a great way to spend an afternoon leading up to the celebration of the birth of Christ. It&#x27;s not a special effects bad guy hero film, but it is what it promises to be and it fulfills its promises well. I highly recommend it and wish it was going to be in theaters longer.	10
Educational Movie - Made For TV Quality	United States	Well we saw the movie. It wasn&#x27;t what I expected. I thought it was going to be a regular movie. Instead, it was an educational movie; he gave you different reasons, ideas and ways to think about the Christmas of today. He also discussed how the different factions would like you to think about Christmas; it&#x27;s all Pagan, there&#x27;s nothing about Christ left in it, why the tree, why the 25th of December, etc., and how to keep it based on faith, etc. Not bad. Internet Haters will hate on this but this movie isn&#x27;t for the regular movie public, it&#x27;s for believers and kids. I do agree that the poster is misleading; if you judge the movie by the poster you would think that it&#x27;s a comedy - family - faith based movie. It&#x27;s not, it&#x27;s an educational, faith based movie, with a few laugh, but it&#x27;s not a scripted comedy in the least. Run time was short as well which was good. Pretty tight and to the point.	7
