Godfather Two is Coppolas movie---and he had no instincts for the mafia. The Godfather author, Mario Puzo, objected to having Michael kill his own brother, but finally gave in to keep his share of the Hollywood millions.Godfather Two has lightweights as heavies: the drunken New York mob guy and Hyman Roth cant compare to Barzini, Sollozo, and the other heavyweight bad guys of the original Godfather written by Puzo.Godfather Two loses the atmosphere of the mob while it meanders lengthily into Cuba.The main point that makes Godfather Two inferior is that it does not contain a single sympathetic character.The endless scenes in the Lake Tahoe home of Michaels are tiresome, dreary after a while, and lack interest as compared to the original Puzo story.This movie shows a deterioration from the original, just as the mob has deteriorated in recent years.Coppola had no right to think he could write his own Godfather, and his inferiority to Puzo when it comes to dealing with the mob shows up here in technicolor.Meanwhile, poor Mario Puzo watched his story being degraded by the instinctless Coppola, objected at first, and then gave in. Pathetic.The only scenes that actually ring true here are from the original Puzo book (the earlier life of Vito Corleone).The contrast between the dreary Coppola script of Godfather Two and its dreary characters is brought home strongly by the final (flashback) scene where Sonny Corleone and the others are around the table. As soon as Sonny appears, everything comes to life.	4
What else can be said about The Godfather series? One small gripe: The storyline shows young Vito Corleone (Robert Deniro) murder the local boss, then basically take control of the neighborhood. Historically, there would have been a dozen other guys in line to take the bosss spot -- young Vito, with no real connections outside of his petty thief neighbor, would have been disposed of immediately. In real life, bosses were bred into the position or it was taken hostilely from the inside. By the era that this movie portrays, Sicilian black handers and Neapolitan Camorra (among others) were fairly organized -- But, hey, its a (great) movie :)	8
Seven years after the first film, Michael Corelone (Al Pacino) continues his familys quest to become legitimate. Also, more on his fathers growing up in Sicily and coming to America. With Vito being played not by Marlon Brando, but Robert DeNiro.) If you liked the first film, you will like this film. If you didnt, you wont. Its really that simple, since you have all the same great people coming together for this film with just as solid a script and acting as you did the first time. You lose Marlon Brando, but you get Robert DeNiro. I consider that a fair trade.This film has two things going for it: it has the early years of Don Corleone, which really fills in the missing mythos around the family. Without this, the film would appear to show the Corelones were always powerful, which is far from the truth. It does not explain how Don Corelone grew to talk in such a mumbled voice, though.Also, I really enjoyed the entire Cuba sequence, because it put the film in a historical time frame (and I like Cuba). I was never fully sure when the first film was taking place, but this one made sure I knew the years when Don Coreleone was growing up and that the present day was not 1974, but rather in roughly 1958-1959. That changed my perspective on things completely.If you have invested three hours in the first film, invest three more in this one. Why only get half the story of Vito Corleone? I cannot make any suggestions for part three, though, one way or the other.	9
Wow. This thing is almost three and a half hours long and yet it is not boring for a second. Not one moment. From the very first scenes up until the tragic and forlorn ending, this film seizes hold of the viewers consciousness and does not ever loosen its grip, even when the credits roll. I walked away from the movie with what felt like a deep resonance inside me. It is at once heart-wrenchingly sad and stunningly beautiful.Thematically, it actually shares much in common with later films such as American Beauty and Fight Club. The Godfather Part 2 is the story of a man who seems to have it all - but the only things he ends up not having are the only things that truly matter to him. Michaels character arc continues on from the first film, creating a great, epic tragedy and what I think is one of the saddest and yet most majestic endings in film.I havent even talked about the more technical aspects yet. This is because I dont have to - everything is perfect. Not just great, but perfect, as in there seems to be no way that they could be improved on. Acting, direction, cinematography, script and story. Everything.The one thing, though, that clinches it for me is that the plot doesnt really matter. This is a movie about themes and ideas. The plot is quite thick, so dont worry if you dont get it - you dont have to. As long as you understand what the film is really about... you will walk away knowing that you have witnessed something almost life-changing.	10
I personally think that this film surpassed the glory of The Godfather I. you will have to watch it time and again in order to understand the nuances of its brilliant film-making. the characterizations are exceptional: 1. Micheal Corleone (as the new don torn between family & business) 2. Hyman Roth (as the scheming old villain) 3. Kay Adams Corleone (as the worried wife) 4. Robert Duvall (as the loyal lawyer) 5. John Cazale (as the betraying brother) 6. Robert DeNiro (as young Vito) etc. etc.... Its just Brilliant!!! Speaking about the film-making the parallel narration of two different but interlinked stories is a fresh new lease of screenplay. the cinematography is outstanding. the indoors are lit up beautifully with overhead lighting which puts a shadow over the characters eyes making it impossible to say what theyre thinking. But unlike the first part where they had broken all the rules (the characters are established first before the place and time) in this film theyve come back to the rules (the locations are established before the characters) Francis Ford Coppola should definitely be given another chance to make a sequel to the trio-logy so that the present generation can also experience the Magic of the Movie and for anyone whos not seen this film, I bet theyre surely missing something in life...	10
Its not easy to be a son, Fredo. Its not easy. Is undeniably the best sequel ever made and one of the best films ever made. First off, Robert De Niros performance as the young Don Corleone completely owns. Pure genius, pure craft.Secondly, well its Pacino, all Pacino. One pure example, at its best is when Diane Keatons character confesses to him  it wasnt a miscarriage revealing that instead she had an abortion, so that she wouldnt bring him anymore sons into the world. Watch Pacinos face during this entire scene!!!!!!!! Or the last flashback scene where Michael reveals that he has joined the Marines to the disgust of his family and such, at this time he had his own  dreams now, we simply watch the price which Michael Corleone has paid himself for power.	9
I have been forced to watch the Godfather trilogy by a friend of mine who thinks, as do most people, that they are the best thing since sliced bread. I found The Godfather just about watchable, but no more - I would have given up if my friend hadnt been there, but this was completely intolerable. I couldnt follow who the people were (and didnt care) I couldnt relate it to the previous film. I couldnt relate the 1930s stuff to the 1950s stuff. There is no excitement no tension, no nothing. A complete waste of an evening. And its so interminably long too. Im having trouble filling out my ten lines for the review, because the film left almost no impression on me - except that feeling that I used to get at school when I was forced to sit through the most boring lesson in the world. And God help me, Im going to have to watch the third one. Like taking cod-liver oil. Ugh.	8
After the success of 'The Godfather' and having been turned down for a part in the first film, Robert De Niro follows hot on the heels of Al Pacino by being cast as the younger version of Vito (Marlon Brando). In it, we see a 30 year old Robert De Niro being taken from being a clean cut young man, probably not as striking as Pacino with his large brown eyes and dark hair, but interesting to look at none the less. Although not innocent looking, De Niro goes from being clean cut to being the gangster that we have come to know and love in the 80's and 90's at the guiding hand of Francis Ford Coppola. No wonder he won the award for 'Best Supporting Actor' to Pacino's leading role. As a whole, the film wasn't as cinematic as the first one, the range of characters that dominated the predecessor was not there is this follow up. However, the film was dominated by Robert De Niro, and it's almost a pity that De Niro and Pacino didn't meet. They would have to wait until 22 years later when they would team up in 'Heat'.	7
Part II in The Godfather saga carries on in much the same vein though Marlon Brando is sorely missed. The plot has Al Pacino exerting complete dominance as mafia boss in the fifties. The film also depicts young Vito Corleones (Robert De Niro) early years. This segment is slightly nostalgic but superbly acted by De Niro who won a Best Supporting Actor Oscar. As a result of the film moving both backwards and forwards in time, it feels more convoluted than the first part. Robert Duvall and Diane Keaton both impress. The shocking climax (MINOR SPOILERS) mirrors the ending of the first film. Highly recommended.Overall 9/10	6
The accepted wisdom about sequels is that they tend to be less good than their predecessor as there is no story left to tell. The second Godfather is an embarrassment of riches in as much as there are two stories; the back-story of Vito Corleones arrival in America and that of Michael making good his grip on the inherited business.All the fine film-making that made the first so rich has been replicated and improved in this most handsome movie. Again we begin with a great set-piece (a Catholic confirmation) as a swarming expository melange of character and situation but which takes its rather more sober tone from the films prologue, telling of Vitos flight to America. The familial infections that poison this particular, warped Italin-American dream are doubly intense given that Michael is now the capo - where the threats of the first came from without, now there is danger within.Pacinos performance is first-class, never once resting on the laurels of his previous Oscar nomination. He is matched across the board by the rest of ensemble; Diane Keaton, Duvall and the twitchy Cazale are fine, and Ive always been a fan of Talia Shire whose performance as the Michaels widowed sister is a magnificent, discreet study in intractable sororial bitterness and love. A deeply sad and violent movie but one which never rules out the possibility of sympathy or redemption. An awesome achievement. 9/10	9
I remember saying in my review of The Godfather that i was going to review this film a week later, that was more than one week ago thats for sure. I did actually start watching The Godfather Part II the next Friday, though i stopped watching after an hour because i wasnt really in the mood for it! So i decided that today, with nothing else to do, id give it another try and i wasnt disappointed! It was a great film, lots of talking but its still great fun to watch. I only have one criticism, the length. It was extremely long, about 3 and a half hours! But thats my only criticism, everything else was spot on! Hopefully ill be watching The Godfather Part III soon and as soon as i do, ill post my opinion right here! So overall, The Godfather Part II is just as good as the original Godfather If you havent seen this film yet, watch it now!9/10	8
Warning! Spoilers Ahead!The Godfather, Part II is another gem of a movie, worthy of a place alongside its revered predecessor. This movies strengths lie in Copollas retention of the best actors from the first film mixed in with terrific new actors for the second. John Cazale, Lee Strasberg, Robert de Niro and Michael Gazzo are given their moment to shine here, and play credible and unforgettable characters. Al Pacino, Diane Keaton, and Robert Duvall reprise their roles from the first movie, and put in an equal amount of effort to the first film, which means that the second is also very good. Copolla had a lot more creative freedom with this picture, but it doesnt differ much from the first in terms of style and camera angles. Still, the director does an admirable job crafting an interesting and wonderful film.Pacinos Michael Corleone is, in the first, a quiet and understated character most of the time, only this time, whenever the character is riled by a tragic event, Pacino lets out his infamous scream to emphasize that his character is like a dangerous time bomb with an unpredictable temper: one minute hes calm, the next hes in a rage. Unfortunately, Pacino is most remembered for his loud, bombastic performances rather than his understated quiet ones. Keaton appears to have less screen time, but, like her husband Michael, undergoes a credible transformation from the naive, submissive character we remember from Part I into an assertive, strong woman who will not give in to her husband. She asserts control over her own body by aborting her baby rather than letting Michael have another heir to his criminal empire. Again, Keatons performance is usually cited as the weakest of the Godfather saga, but this seems unfair, and she does well whenever she has screen time. Robert Duvall is back with another excellent turn as Corelone family adviser Tom Hagen.The new faces do very well here, and again, Copolla was blessed with an excellent cast. Gazzo is simply delectable as mobster Frank Pentangeli, one of cinemas most memorable characters. One minute hes a lovable old man, sometimes seeming as dopey and sweet as your great-uncle, asking the band to play an Italian tarantella; the next hes viciously asking for the blood of the Rosato Borthers. He, ultimately, cows to Michaels control during a Senate hearing, just as he is about to rat him out.Gazzo, a prolific playwright, showed he had the chops as an actor as well. Another memorable performance is the Italian actor who played the gangster Don Fanucci, a dandy tyrant who shakes down Italian immigrants for protection money. He, like the guy who played The Turk Solozzo in Part I, is a convincing actor who can make a slimy villain come to life. He seems to relish his role as the white coated mobster who confidently rules the neighborhood with an iron fist. Less potent is Lee Strasbergs Hyman Roth, who, after Don Fanucci, is the films main antagonist. Roths true evil is only revealed in other characters dialogue and indirect screen action rather than anything we see Roth do on the screen. I wasnt fully convinced that Roth was a cunning double-crosser, as we dont actually see him engage in the double-cross. Strasberg gives an understated performance as the kingpin of the pre-Castro Havana casinos (an obvious representation of real-life gangster Meyer Lansky). Still, Strasberg does have some memorable moments, such as the famous This is the Business Weve Chosen speech he gives to Michael.Fresh performances from John Cazale and Robert de Niro round out this movie. We dont see much of Fredo in Part I, but hes essential to Part II. Cazale gives a memorable performance as the meek, weak, sweet, but ultimately treacherous middle brother of the Corleone family. His flaws include his lack of intelligence and possible naivet&eacute;, which ultimately result in his being a pawn in Roths scheme to kill Michael. Fredo wants the keys to the kingdom, but will settle for some power, and Roth apparently offered him something special for his services. All Fredo says is that there was something in it for me!, but what this was is rather vague; still, Fredos ties with Roth are enough for Michael to commit the darkest murder he will commit in the saga: fratricide. We almost feel sorry for Fredo as he sweetly tells his nephew how to catch a fish by reciting a Hail Mary, right before Michael has one his goons shoot him from behind on a fishing trip. Fredo may be the rather weak and dopey member of the Corleone clan, but Cazale also manages to humanize Fredo and make a memorable performance as the ultimately tragic odd man out in the family business. Part II carries with it a sadder tragedy than Part I, as Michael loses his family, in terms of his wifes abortion and departure, and Fredos treachery and his eventual murder. It is in Part II that we see the full scope of the perils of a life of crime in terms of keeping a family together. Even Don Vito, while running a criminal empire, was able to somehow keep his family glued together. We see the sad irony when Michaels mother tells him you will never lose your family. This is an excellent movie, much like the first one. Copolla does well here. (Copollas further career is debatable. Radio host Phil Hendrie once gave a hilarious criticism of Copollas career: what do you mean Charlie dont surf?!) He directs beautifully here, and the actors cooperate by giving excellent performances. This is a highly recommended movie.	9
...are included in Part II. This movie gives you the backstory of Vito Corleones rise to power, from the time his father is murdered in Sicily until he makes his bones and creates his own empire in the United States. Robert DeNiro is very convincing as young Vito Corleone in what was, if memory serves correctly, is his big screen debut. I was almost convinced he was somehow related to Marlon Brando, he had the voice, the looks, the mannerisms, everything. Couple this with another story not included in the book of betrayal within the family while Michael tries to make a move in pre-Castro Cuba and you have a sequel that is every bit as good as the original. Michael has been stripped of all his humanity in this story, and he comes across as being a cold and heartless human being, one who would even have his own brother killed to preserve his nefarious empire. The ending is heartbreaking because he realizes that he lost his family trying to save it. And the soundtrack in this movie is even better than the original GODFATHER soundtrack. For the third time, Im going to give a perfect 10 to this movie.	8
I got the privilege to watch this film for the first last a few days ago. This has to be my favorite film of all time, along with one of the best films that I have ever seen.The movie does very well in shown two different two stories in one movie. You have Michaels story of which shows his struggle in controlling one of the most powerful crime families in the United States. The second story is Vito Corleones struggle as young boy in Sicily growing up and coming to America, and his start of the Corleone crime family.This is a long film to watch, it took me a few days to watch it, as I watched about 30 to 40 minutes at a time.All of the actor and actresses preformed there roles very well, and the actors and actresses who got Oscars for their roles in this movie were VERY WELL deserved. Robert De Niro does one of the best acting jobs I have ever seen in film, in my opinion one of the best actors in 1974.The script is well written and for the most part is easy to follow.If you seen the first film, which is a must to understand this film, then you will like the second one, which is one of the best films of	9
The Godfather II, in my opinion, is just as good as the first. So rare is it for a sequel to be as gripping and as well-made as this movie is. First off, I have to mention the excellent musical score. It gives the film a sort of dark, moody atmosphere, and I think it was a very good idea to use the same score as in part I. Secondly, the idea of inter wining the story of Michael Corleone and of his early father Vito was brilliant and makes this sequel stand out from the first part. This idea of showing two stories in one film could have been quite risky and confusing but Coppola did a fantastic job at it. Both stories are very clear to follow and show the contrast between Vito and his sons way of handling the family business.Of course, I cannot comment on this movie without mentioning Al Pacinos awesome performance. He definitely should have won the best actors Oscar for that role. He has unbelievable screen presence and plays incredibly well the ruthless, suspicious Michael Corleone. The most poignant scene of the film, in my opinion, is definitely the one where Michael finds out at the party that his brother Fredo betrayed him.	6
Sequels rarely rise to the level of the original, and almost never surpass them. This phrase has been used so often in reference to The Godfather: Part II  the exception that makes the rule. What is even more laudable is the fact that the original is generally considered as a landmark in the history of film.This is one film that proves cinema to be a form of art, and not merely one of entertainment. A skilful direction from Francis Ford Coppola, outstanding performances from the likes of Pacino, De Niro, Gazzo, Strasberg, Cazale, Duvall, Keaton, Shire, memorable cinematography from Willis, a soundtrack by Rota, Coppola and Curet Alonso, and an ingenious script by Coppola and Puzo (partly adapted from his novel), make The Godfather: Part II stand out as a story of courage, love, treachery, and devotion, crafted in the life of the Corleone saga.The plot follows the consolidation of power of Michael Corleone, and his desire to gain the legality of his business, and the consolidation of power of a young Vito Corleone, and his desire to build a better life for his family. The old story of the father handing his wealth to his sons, gains a new twist by allowing a positive outcome to the original story. The wealth remains in the family, but there are losses to be incurred. An ontological thesis of Pareto optimality into the organisation of social structures is subtly brought into the view, without harming the general development of the story.The Godfather: Part II remains also as a text book for any actor. Al Pacino shows that temperance can be dramatic, making us empathise with his character even when made to realise the most brutal of actions.  Robert De Niro is purely outstanding, in one of the best supporting performances the screen has witnessed. His charm, charisma, and vocal skills, help him achieve a complete transition to Puzo's Vito Corleone. The viewer is unarmed in the choice given between murder and love, between life and necessity. Talia Shire stands out as the lost woman in a world dominated by men.Even if The Godfather is the point of reference when it comes to great cinema, The Godfather: Part II remains a powerful example which proves that there is always more to say in a story, and the additions can be more than surprising.	7
someone made the comment that he didn't understand why the flashbacks to don corleone's rise to power (with de niro as don vito) were included, that it romanticized the Mob.  i think the reason that we have the 2 stories is that they parallel each other.  while we are seeing how michael corleone is developing as a mob boss and as a man, and what forces are shaping him, we also see the same things in his father's early life - how don vito reacted to events, how he made plans and how he became the man he was.  although both men lived a life of crime the difference in the two is striking and real - don vito worked his way out of poverty and immigration and tried to help his fellow italians in a way that seemed to work for him.  don vito never lost his sense of caring for people in general and that they depended on him.he never lost his love for his family.  he never lost the common touch, the things that would endear a man to a community and win their loyalty.  when we look at michael in his criminal growth we see he becomes a completely different man - cold, ruthless, uncaring and increasingly isolated both from his family and from the greater community.  don vito actually served, however wrongfully, a purpose in his community and did some good - he provided political and financial assistance, and a basic justice to many people who would have been denied it otherwise.  michael corleone however is just a nasty, vicious, unfeeling, opportunist who does not have the same human touch his father did. and i think that is the main revelation of the 2 movies and why we have the flashbacks.  frankly i prefer the first movie, and the flashbacks in the 2nd movie - don vito was a better man.	8
By the end of this classic sequel to The Godfather, I absolutely felt nothing but hatred for Michael Chorleone.  Even though he waited until his mother faded off to kill Fredo, I still couldn't feel anything for Mike. But when you see the last shot of the film, you realize that he is going to regret it for as long as he lives and will fall into a deep depression for the next decade or so.  How could he be so mad at Fredo for being tricked by those two rats, Hyman Roth and Johnny Ola. That wasn't exactly all Fredo's fault. But, you not only do you feel the neglect from Michael to Fredo, but you feel the neglect from Michael to his family and household.  That was one of the really haunting parts of the film.  Michael's neglect is what causes him to fall into the deep depression by the end of the film and into the third installment of the trilogy.  Francis Ford Coppola has a true gift in film making and to this day remains one of the best directors in the business. The best of the trilogy.10/10 The best film ever made. *****/*****	6
