Francis Ford Coppola came perilously close in this film to accomplishing something rarely, if ever, done: he nearly made the second movie revolving around a particular set of characters and themes better than the first.In the truest sense of the word, Godfather II is NOT a sequel, nor was it intended to be. What Part II does is fill in details about Don Vito Corleone's arrival in America and rise to underworld power. That story was told by Mario Puzo in the novel, but involved too lengthy a story to include in the 1972 film. Coppola and Puzo did the next best thing: they told the prequel, the rise to power of Don Vito Corleone (Robert DeNiro) and then appended to the prequel the story of the Corleone family subsequent to Michael's gangland triumph at the close of the first film. Appended should not be taken to have a pejorative connotation. There is certainly nothing slapdash about the tale of the Corleone family's fortunes following the obliteration of the rival gang leaders at the end of the first film.Al Pacino is stunningly believable as the still-reluctant Don Michael Corleone. He wants to move the family business toward legitimacy, but in the end events compel him to be strong for everyone by taking down all of the family's enemies, even when one of them is his older brother Fredo (John Cazale, again brilliant).Unlike the first film, Coppola does not pull off the same level of audience empathy for the Corleone family in the second film. Clearly the life of the crime boss is costing Michael everything while he gains all the power in the world. The first film is more equivocal on that point and also remarkably draws the viewer into a world where the Corleones can be viewed with some empathy. In Part II, Michael is far more cold-blooded and consequently a less sympathetic character. He seems less drawn into the vortex of organized crime by unexpected events, as was the case in the first film, and more the ruthless manipulator.This is really two great films in one. Vito Corleone's rise to power is portrayed with subtle intensity by DeNiro, always observant and always absorbing important information from his observations. Those scenes really capture remarkably the story of Don Vito's early years woven by Puzo in the novel. Wrapped around that prequel is a marvelous continuation of the original story with remarkable twists and turns and deft uses of historical circumstances (Congressional racketeering hearings and the Castro revolution in Cuba). This is another magnificent film, and fitting second step in the Godfather story.Don't end the story with the first Godfather movie. See them both. As for Godfather 3, well, if you really want to go ahead, but be prepared for a let down.	10
I have to agree with Robert Towne when he said this film is one of the greatest achievements in the history of screenwriting. When the camera follows DeNiro as he moves from rooftop to rooftop, falling into the abyss filled with crime and corrpution, it will affect him and his family forever. DeNiro is slick and smooth as the young Vito Corleone. The rise of Michael Corleone's power is superbly captured by Coppola and delivered with cold hearted villainy by Al Pacino, in his finest performance. Strasberg is also solid in his performance of Hyman Roth. It's nice to see him put that method to work. The only one who feels out of it here is Duvall who seems to be simply going through motions. It may have been that Tom's character is also given limited depth within the script. It is a superb sequel, argued by many to be superior to the original.	10
Michael Corleone continues his rise within organised crime in 1950's America, by expanding his family's empire across hotels and casinos.  When an attempt on his life fails Michael proceeds with his dealings in Cuba with Hyman Roth, a deal that will not be as straightforward as it appears. Meanwhile we are told the story of a young Vito's move to American and his rise from the ghetto up into the world of organised crime.I don't know what I can actually add to the sheer weight of praise that has been heaped onto this film - it is as accomplished a film as everyone says and is rightly one of the few examples of a sequel improving and building on a film.  The plot follows two separate strands, the continuing rise of Michael that is as much detrimental to his family as it is beneficial to his pocket; the other thread being Vito's arrival in America as a child and his rise up within the Italian ghettos.  The two stories are not as intertwined as I had remembered - they are very separate and the film can go for quite a while before it switches over.  In a way this works better as it allows both stories to go ahead without fragmenting either too much.This film, as with many gangster films, has been accused of glamorising the life of crime and those involved in it, however, if anything Godfather II does this even less than the original did.  The film shows the moral collapse of Michael in the same way as the first showed his power.  In fairness it does contrast the rise of the two dons - showing how Vito manages to keep his family together.  Despite this I would still argue that Michael's path is far from glamorous.The two narratives are both excellent but for different reasons.  Vito's rise is very interesting and provides solid back story to the first film and we can clearly see the change in Vito from a quiet young man to the influential powerbroker that he became - we also sadly see the rise in his demons and his viciousness.  Meanwhile Michael's tread sees more powerful deals and double crosses as he continues to gain more power.  This was overly complicated for me the first time I saw it but, with reviewing it I have gotten more from it each time - more understanding and more enjoyment. The twin stories are both engaging and the three hour plus running time passes effortlessly - this is a saga and it never feels like the running time was anything more than what was necessary.The cast are fantastic.  Naturally the kudos go to the two leads, and they deserve it.  Pacino has a less showy role than in the first film as he has already done his falling - here we only see further proof of the corrupting nature of his power.  De Niro steals the film this time with a measured performance that parallels Michael's change in the first film - it is a performance that lacks a certain amount of personality but shows us the traits that the film is interested in.  As before the support cast are great, Duvall is reliable as ever, while the most improved role goes to Cazale, who's Fredo becomes more important to the story and almost becomes a biblical character.  Quality comes in waves with Shire, Strasberg, Spradlin, Kirby and many others with solid performances.  Keaton is good but she is not given as much time as I would have liked, even if her scenes are important and powerful.Overall this is a great film that is based on a classy pair of stories that bring the subtexts with them and a collection of characters that are well developed by a script and some great actors.  It may be a little too lavish and plush for my own personal tastes, but it is a rich story.  To a certain degree the production values and sheer class of this film could be accused of glamorisation, but generally those who say this have managed to totally miss the fact that this is a cautionary tale that shows the corruption of power.	8
Robert De Niro became the only actor to win and Oscar for taking over another actors Oscar-winning performance. He was not, however, the first or last such actor to be nominated for this. Grard Depardieu was nominated for Best Actor in Cyrano DE Bergerac (1990), a role that had already won an Oscar for Jose Ferrer. Like Brando, Ferrer had played his role in English. Like DeNiro, Depardieu played the role in the characters native language; in this case French. Years later, Jeff Bridges would be nominated for his performance in True Grit (1969). John Wayne had won his only Oscar for his performance in the original film, which also featured Robert Duva.	10
The second outstanding point, similar to the first film, is the beautiful visuals. Although all of the cinematography and production design is great, what really impressed me were some of the darkly lit scenes. Characters and features of sets emerge from pitch- blackness, and everything is rich, deep shades of burgundy, brown, and orange. Amazingly, nothing gets lost in these scenes. It must be incredibly difficult to achieve without making the shots too dark, because I cant remember another film since that has been able to capture the same look. The flashback scenes are also in similar, but lighter, colors, creating an appropriate sepia-tone feel.Although the broad perspective problems are unfortunate, a closer focus on most segments of the film provides exemplary artistry. Given that, and the films importance culturally, The Godfather Part II is a must-see.	10
The first sequel to win the Best Picture Oscar, and deservingly so, words cannot begin to describe how amazing this film is. Unlike the first (Ill admit, Im not the biggest fan of the first film) which had several slow spots, GFII had me riveted from beginning to end. Pacino and Cazale turn in the performance of their careers, while Francis Ford Coppola, who co- wrote this with Mario Puzo, directs with such precision. This film is truly a gift of cinema by all the talent involved. Everybody, even the smallest supporting actor, give terrific performances. The pace is fantastic. The writing is brilliant. The last scene at the lake...chills! Watch this masterpiece NOW!4/4	10
I rated this movie a 1 star not because it wasnt entertaining or wasnt cinematically compelling. I rated this movie one star because the message this movie delivers is ignorantly backwards. Throughout this film, we watch (in vivid detail) as Chris Kyle assassinates hundreds of Iraqi men, women, and even children in order to protect American troops. And yet, this movie ends a memorial. I understand that Chris Kyle did his job well. But that does not mean he should be honored as a hero. I love the United States. This is an amazing country. And so it bothers me when Hollywood portrays an American hero as someone who is willing to kill people without critically evaluating why they should be killed, who sees war as purely good versus evil, and who is hopelessly blind to the bigger picture. If there is ever to be peace in this world - heck, if we want to protect the US - we need to glorify people who are compassionate, who can put themselves in other peoples shoes, and who act in ways that promote trust and love - instead of fueling the cycle of anger and hate. Go see this movie. But please dont swallow it up without thinking first.	10
This is, for me, one of the greatest of all time. Any sequel to the original - again - one of the all time greatest - was always going to be tough. But to follow it with such a timeless masterpiece is nothing short of astonishing. The acting all round is utterly electrifying - from the big performers to the bit part players and extras. Each part is played to perfection. This is one of those rare movies that is totally complete. Words can barely do it justice. You could watch it a thousand different times and take a thousand different lessons from it. You could notice something each time that you hadnt spotted before. This is cold, unforgettable and absolutely absorbing. If you havent seen it before - go and watch it. If you have seen it before - go and re - watch it. Im not sure well ever see anything that matches its like again.	10
Its hard to give an objective review when you are dealing with favourite movies. Having just watched this for the first time in years I was delighted to see it was as magnificent as I remembered it. Francis Ford Coppola would have been sensible to be wary of doing a sequel when hed just made a film as acclaimed as The Godfather. How do you follow that? Amazingly he managed to broaden the themes of the original, producing a study of power and corruption that may be unequalled in Hollywood history. And whereas some critics found the first film questionable in its moral compass (is Michael supposed to be a hero?) the sequel leaves us in no doubt that he has passed on into something else and as his wife Kay shrewdly notices, there is no coming back. Judge the film on its own merits and ignore the continuation of the saga in Part III. This is the final Michael as we should always remember him.The scope of Part II is extraordinary (as if the first film wasnt bold enough!) with the story of father Vito in 1920s New York cross- cut with son Michaels rivalry with ageing mobster Hymen Roth, a respected, though never trusted, business partner of his father. These later sequences may not make sense on first viewing but there are some remarkable set pieces from revolutionary Cuba to a Senate committee in Washington. This is a no holds barred portrait of American society corrupt and hypocritical from top to bottom. How often has Hollywood been so daringThe film invites a contrast between father and son, with young family man Vito embracing criminality out of necessity and using his status to become a Godfather in the Italian American community. Meanwhile in his middle age Michael has become a Don hooked on vengeance with all business now personal. The inevitable conclusion of which is a violent crescendo with him not just wiping out his enemies (again) but committing the far worse sin of betraying his own family. Few films can have gathered such a fine cast. Al Pacinos Michael is the symbol of idealism turned sour in extremis. More than anything this is what elevates The Godfather over so many other gangster films. Hes not just some Goodfella or ordinary guy, he once aspired to be a great man but somewhere something went wrong. Robert Duvall as Tom Hagen is the great constant across the two films, always at the side, never changing, but in his reaction to the transformation of Michael we get confirmation of his moral decline. Diane Keaton as Kay has a meatier role this time and as the voice of respectable America shows the futility of Michaels actions. If he cant keep his family together, whats it all for? John Cazales Fredo is a tragedy of his own. Secretly resentful of his younger brother, their mutual betrayal becomes one of the emotional cores of the saga. Replacing the character of Clemenza proved relatively easy as even if the story loses something, Michael V. Gazzo was memorable whilst the legendary Lee Strasborg is a suitably cast as rival/partner and pretend Uncle to Michael Hymen Roth, delivering one of the movies great speeches.So often artists seem burdened by great achievements, but not here. One can only assume that the young Coppola was so exulted by the critical and commercial phenomenon of The Godfather, he felt capable of anything and judging by this, he near enough was. One only wonders why hes largely struggled to reach similar heights ever since.	10
I love this movie for of the very interesting scenario. I also consider the actors playing, certainly amongst the best of their generation. Decors, costumes are also part of the reason I love it.The fact it is about European immigrants in the US, makes it also better for European to watch, without it being one 100% US culture movie. Also some points are true story, that makes it quite remarkable.Overall, I can say that this movie is truly violent, but not as per 2015 understanding. The violence can come in many ways. However, and despite this aspect, this is quite one remarkable movie which deserves to stay up and high in the IMDb ratings.The second part is maybe the best, but is actually really close from the first episode, which in my eyes is actually on the same level.	10
This movie is way to be good to be labelled a sequel to The Godfather . Rather it is more of a companion piece to the original and the two perfectly compliment each other . IT is both a sequel and prequel showing the rise of the young vito and moral decline of Micheal . Both characters are brought to life with uncanny ability by Robert DeNiro and Al Pacino . To say that these two are good actors is like saying that a nuclear bomb makes a loud noise and in this movie they prove why they are at the top of their respective crafts .Al Pacino is the standout in the ensemble cast and its amazing how his eyes have changed from the first part . They are now cold , ruthless and unemotional and betray the price which Micheal Corleone has paid for power .Watch this movie and learn why it is the greatest gangster film of all time.i copied bcoz i needed .	10
People say that The Godfather: Part II is one of the greatest hits in history.And I cannot disagree!It hits exactly what I was looking for in a Godfather sequel.It puts all the other godfather movies to shame,and hits all the marks from the previous movie spot on.The reason I gave it a 9 of 10 was because it went a over the line a couple times with some things, and is a tad bit lengthy but still enjoyable.Although it is not part of the book and just a long extension of it but still incredibly entertaining.I doubt the only other legitimate criticsm is that this movie is freaking awesome!It always keeps the ball rolling and never backtracks you,and always keeps you up and going with famous scenes and unforgettable one liners.This movie was a launching pad for many famous modern day actors to make their mark.For 1970 this was immensely un cheesy and one of my very favorite movies.I highly suggest watching this movie if you have 4 hours of your time to sit back and watch a masterpiece.I suggest to watch the first one just to catch up.I have never seen a better sequel since The Winter Soldier.The only way you cannot enjoy this movie if youre only in to modern day crap!	9
The Godfather debuted in 1972 to rave reviews, millions in box office receipts, and awards galore. Obviously, there was high demand for a sequel. So after great anticipation, could it be possible for Coppola to deliver?Everything great about the first film is equally great. The film follows two story lines, I believe this choice is perfect because it separates part II from the original, while showing the contrast between don Vito, and don Michael. Vito was in control, a family man, made compromises. Michael has no remorse, business is his first, and only priority.In my opinion the first and second godfather films are perfect. They are entertaining, but by perfect I am referring to the technical aspects of the films. Everything that filmmaking represents is in the forefront of the godfather and the godfather part II. On a side note, I dont understand this notion that the godfather films are the best films that nobody actually watches. I watch the first two at least twice a year.	10
The Godfather Part II is said by many to be the best sequel ever. I personally think that is arguable, since it arguably surpasses its proceeder and checking out the Lord of the Rings sequels and the Empire Strikes Back. Say this is the best sequel ever and I will not disagree. Say this is better than the first and I will agree. Honestly, I keep changing my mind about which instalment is better every time I watch them. This last time I watched them, the first one seemed better to me. The time before, this one was the superior picture. I dont care which is better, as long as I have 200 minutes of no interruptions while watching this.With the success of The Godfather in 1972, it was only natural for there to be a sequel. The Godfather Part II acts as both a sequel and a prequel, with the sequel being written by Coppola and Puzo and the prequel being taken from the novel. When Pacino broke out in the first movie, he topped it one year later with Serpico. His performance in this tops Serpico and everything else hes ever done. Unfortunately, he lost his sure Oscar win to Art Carney. Yes, Carney was worthy, but put him in the same category as Al Pacino for perhaps the best role ever and he becomes very unworthy. The people at the Academy probably thought Pacino would just get better and they could give him an award later. That would not come until 1993 when he won for a role in Scent of a Woman that was inferior to all that he did in the 70s. At least the Academy got the Best Picture win right. That was a given. Pacinos rival/friend/co- star, Robert De Niro took home the win for Best Supporting Actor, beating out their acting teacher, Lee Strasberg. De Niro became the first Oscar winner to not say a word of English. I dont know what it was about his portrayal, but there was some sort of magic contained with utter brilliance. Strasberg and Michael Gazzo where also fantastic, but both did not possess an unknown magic that few can bring to the table.The prequel follows a child Vito Corleone whos family is poor. He witnesses his family begin murdered by Corleones most powerful mob boss. He heads to America and grows up on the streets there too. Years later, an adult Vito (De Niro) rises to the top of New Yorks underworld and is determined to avenge his familys death. Revenge stories like this have been done to death, but almost none have been executed this good. The sequel takes place a few years after the first with Michael (Pacino) as the Don. After he successfully dodges an assassination attempt, ordered by Hyman Roth (Strasberg), Michaels fears about loyalty, betrayal and murder lead him to a severe paranoid state making him a deadly madman. Both stories are less complex than the original, but both together make one hefty team. Al Pacino outdoes Marlon Brando and himself in one of the top five greatest roles of the screen. He leads an all-star cast in what is arguably better acting than the first. With most of this being arguably better than the first, Coppolas direction surpasses the first. The cinematography, sets and camera tricks beat out all the first had, which were great.	10
My opinions on this movie are a bit mixed. The opening for the film was brilliant as it delves into the early life of Vito Corleone and then flash-forwards to the story of his son Michael Corleone following the events of The Godfather (1972). It was all interesting up until it started faltering during the lengthy middle portion of the film, when Michael travels around to various different places meeting different underworld figures. The pacing and editing was quite bad during the middle portion, so much so that I even found it somewhat boring to watch. It could have been better if Francis Ford Coppola was willing to trim some bits here and there during the middle portion. Nevertheless, the final portion of the film was back on track and largely made up for the weak middle portion. Like the original Godfather, the last 80 minutes of The Godfather Part II were very gripping and moving, with the ending probably being even more powerful than that of the original. The film had the potential to be just as good as, if not better than, the original Godfather if only if it wasnt for the overall inconsistency and the weak middle portion of the film.As for the performances, Al Pacino was again brilliant as Michael Corleone, while Robert De Niro was also very believable as a young Vito Corleone. The other cast members were also impressive, with some of the more minor characters from the first film, like John Cazale (as Fredo Corleone) and Diane Keaton (as Kay), getting more major roles this time around. Although I have criticized this film quite a bit, those criticisms are only relative to its predecessor, as The Godfather Part II is still quite easily among the greatest crime films of all time in its own right.9/10	9
