A Must-See Comedy!!!	United States	OK, yes this movie is terrible, but it&#x27;s still enjoyable. It&#x27;s so bad that it&#x27;s good!! If you&#x27;re the kind of person who can appreciate movies like Troll 2 and The Rocky Horror Picture Show, then you&#x27;ll love this movie. There&#x27;s so many things to make fun of; the terrible acting, the weak plot, the locations, the sound equipment and goofy CGI effects are all worth a look. This movie is so bad, it&#x27;s good! Seriously!! If you want a good time, get some snacks and buddies and watch this movie. The wisecracks will never end. You&#x27;ll be amazed how many useless characters just pop up out of nowhere for the sole purpose of explaining the plot. You won&#x27;t believe how much gun ammunition the main characters have to shoot at birds but no food. This movie is ridiculous, but if you have a sense of humor or are a filmmaker and want a guide on what NOT to do...SEE THIS MOVIE!!	1
10 out of 10 best movie ever	Remote island, Pluto	I just want to say that this is the best movie ev- hahahaha - I can&#x27;t keep this up... to tell the truth, this is not a well made movie but watching it was one of the best times I ever had with my friends. It was so bad that it was funny, you really should watch it with your friends so you can laugh at it together. Because of this movie, my friends and I even started a small group to watch bad movies and laugh. This is definitely the best worst movie I have ever seen. But it was very fun to watch and never got boring because of all the mistakes and the bad screenplay. Not to mention the actors... So thank you Nguyen for your horrible sound editing, absolutely emotionless main character (Bagh) and ABSOLUTELY horrible birds. You really did a (horribly) great job. THANK YOU!	10
Was this thing made by retarded school children?	United States	The audio sucks, camera work is erratic, dialog is painfully delivered. Script must have been written in crayon. Establishing shots held way way way too long. Action starts way way too late. Foley is sad, CGI is hilarious.....Were they trying to kill the art of film? The lack of acting skill reminds me of a 3rd grade Christmas play.By FAR the worst movie EVER.Even the Rifftrax version was hard to watch....The only believable actor was the little girl. What is with the fully auto M-16? None of the people in the other cars seem to notice the attacking birds.THIS MOVIE SUCKS!!!	1
Bad ripoff of Alfred Hitchcocks The Birds	United States	SPOILER ALERT. Possibly. I don&#x27;t want to be on the blacklistJames Nguyen&#x27;s fantastically bad remake of Alfred Hitchcock&#x27;s 1963 masterpiece is truly one of the great cinematic tragedies of the 21st Century. From awful camera-work to stony acting to crappy dialogue to the incoherent and ridiculous plot, from the craptastic .gif birds that don&#x27;t do anything to the repetitive loop of the squawking, everything about this movie screams &#x22;just kill me&#x22;. This movie takes the shitty film quality in found footage and makes it shittier. On top of all of this, there is a weak and bizarre forced environmentalist message that claims the birds are sentient and punish humans because of global warming or some bullshit like this. Save yourself the trouble and don&#x27;t watch this worthless piece of crap.	1
Shock and Terror is completely right.	United States	Last night, I went to a local movie rental store with my grandparents to rent some movies to watch. We rented two movies. First, we rented Saving Mr. Banks. It&#x27;s a fantastic movie, I suggest you watch it. Second, we rented this. This was more for my pleasure because I knew neither of them would like it. So, this morning, I sat down and saw it. Oh boy&#x85; This movie stars a guy named Rod. He&#x27;s your average marketer until he meets the girl of his dreams. They go out for a little bit, and then all of a sudden, a huge swarm of birds attacks the city! And that is literally the entire plot. The story is just so random. It&#x27;s almost like a really crappy sitcom for a while then BIRDS! HOLY CRAP BIRDS! What I love most about the &#x22;plot&#x22; of this movie is that the first forty minutes or so is completely worthless. This movie is about birds attacking the series, so why is there so much relationship and work drama? Plus, there are scenes that don&#x27;t make sense. For example, at one point in the movie, a guy goes to the main character&#x27;s house about making a deal to install a solar panel to the house. What does that have to do with the plot? Absolutely nothing. Nothing new was added to the plot, none of this is ever mentioned again, so&#x85; why? What&#x27;s the point? The cinematography is absolute crap. The camera never steadies and focuses on the right thing. Every shot looks like it belongs in a home movie. There are some shots that feel completely random and just out of place. It just looks awful. The editing is even worse. The scene transitions are beyond choppy with so many, many jump cuts. There are literally four jump cuts in the same exact scene at one point. Plus, this movie has that audio static you get when recording with a low budget camera, only in this movie between every scene the level of static changes. And sometimes it goes away altogether. Hey Nguyen- I don&#x27;t know if you&#x27;ve ever heard of this before. It&#x27;s called a boom-mike? It&#x27;s really neat! It makes all the sound sound much crisper without all that audio static. But I see you wasted your entire 10 dollar budget on CGI, so what&#x27;s the point of telling you this? Speaking of CGI&#x85; ugh&#x85; the CGI is poop! It&#x27;s the kind of bad that you can&#x27;t describe just because of the sheer amount of awful it withholds. It&#x27;s just&#x85; bad. All the CGI is put into birds, explosions, and blood effects. Do you think you could&#x27;ve tried a little harder? The birds are absolutely ridiculous. Not only are they animated like crap, but they just make no sense. These birds literally dive-bomb towards the city, kamikaze style, and explode on impact. Also, they have no actual entrance or exit in the movie. After forty minutes of the bullcrap that is the story, the birds just appear and start attacking everybody. No explanation why, they just do. And at the end, they just fly away like it&#x27;s nothing. There&#x27;s no reason why they should. There&#x27;s no indication of anything that happens that would drive the birds away. This plot hole makes the movie all the more pointless. Now I have to touch on the acting. The acting rendered me speechless. Wooden does not begin to describe the acting. Everyone seems like they&#x27;re phoning it in, and even that is being too generous. Everyone does an absolutely awful job. Especially the main character. He brings a whole new level of awful to the table. I&#x27;ve seen better acting from the people that are in the home videos on AFV. And they aren&#x27;t even acting! I just&#x85; I&#x85; I can&#x27;t! I can&#x27;t do this! Overall, Birdemic Shock and Terror is horrendous. The acting sucks, the CGI sucks, the story (or what little there is, anyway) sucks, there are scenes that make no sense, the cinematography looks like it was done by a toddler, the audio is grating, the characters are annoying, everything just sucks! And do you know what the cherry on top is? THIS MOVIE IS AN ENVIRONMENTAL MESSAGE. I&#x27;m serious. The characters in the movie say that &#x22;global warming&#x22; is the cause of all this. Bullcrap! What a cop-out! In terms of quality, this movie is definitely the worst movie I&#x27;ve ever seen. I still like it better than Battlefield Earth, though. Score: 1.0/10	1
The best worst movie ever.	United Kingdom	Birdemic is undoubtedly the worst piece of film-making I have had the pleasure of viewing. Everything about it is badly done: from the sound that clips in and out; the spotty lighting; the weird camera work, the stunted, jarring, awkward dialogue; the &#x22;CGI&#x22; and the total complete utter lack of anything somewhat resembling a plot. However, all of this comes together to create a really entertaining watch. Provided you have a few friends and don&#x27;t attempt to take it seriously, this movie will make you cry with laughter. Its truly an achievement that the movie is so consistently bad, in such a consistently hilarious way.Everyone should watch this masterpiece. Not only will you have a great time, and learn lots about how global warming really works, but you will then appreciate how good other movies really are.	10
I felt my brain melting and eyes aching	Norway	When a movie starts with music that grinds your ears, standard movie- maker font, 10 minutes of random shots from the valleys of Hollywood and an unknown B-movie director that claims he&#x27;s the &#x22;master of romantic thrillers&#x22;, you know you&#x27;re in for one hell of a ride. I don&#x27;t really know if this movie is a joke or not, if they actually went in full force with the intention of actually making a great film with their 10.000 dollar budget, clearly they did not. When the actual film starts, the camera is so horrid I thought the cameraman was drunk, or if I was unwillingly intoxicated. Anyways, I had to check my earphones after a couple of minutes, because the sound suddenly stopped and popped up at random, looks like the sound-mixer of this movie probably is deaf or some sort of modern day Hellen Keller. Let&#x27;s say something about the acting.. if there is any. I felt my heart wrenching when the protagonist started reading his lines, his act is already so wooden after two minutes of screen-time he&#x27;d fit right in the Ents from the &#x22;Lord of the Rings&#x22;-trilogy. When an actor can&#x27;t even walk straight without showing signs of having something rectangular shoved up his rectum, there&#x27;s something wrong.After about 45 minutes of clapping (yes, see it for yourself), a love story that makes the Twilight-saga seem like &#x22;The Notebook&#x22; and &#x22;Titanic&#x22; combined, dialouges that are from another planet and all-in- all all I&#x27;m thinking: Is this movie the &#x22;Shock and Terror&#x22; the sub-title proclamates? &#x27;Cause I haven&#x27;t seen a f*cking bird yet!!When the birds arrive.. No, I don&#x27;t even care to write about it.. I feel ashamed of myself. I feel like laying down in the shower with my clothes on and cry while the cold water is running on full.This movie basically makes Tommy Wiseau&#x27;s &#x22;The Room&#x22; seem like the new &#x22;Schindler&#x27;s List&#x22;. Enough said.	1
Among the best of the worst	None	Oh boy.When I first saw this movie, I couldn&#x27;t contain my laughter. You&#x27;re greeted with 40 minutes of absolutely nothing important AT ALL, and suddenly, birds.That are fixed to the camera.Through all the horrible editing, crappy sound quality, wooden acting, terrible effects, pointless scenes and ear-bleeding sound effects, this is way up there among the best of the worst, along with The Room, Troll 2 and Plan 9 From Outer Space.I definitely recommend to anyone looking for a good laugh.	8
Most amazing piece of garbage Ive ever had the pleasure of seeing	United States	Shocking and terrorizing is right. I don&#x27;t even know where to begin. All I can say is it has the worst editing, worst sound, worst acting, worst directing, worst special effects, worst story, and worst ending ever told. However it is by far the most breathtaking failure I&#x27;ve ever seen. It&#x27;s like watching a work of art by Picasso created with dog poop and vomit under sewage water. Maybe that&#x27;s what makes it fun to watch because of its honesty in trying to make a horror film with very limited resources. The pacing is atrocious though in that you will finally see the birds attack about 45 minutes through the movie and the birds look like Windows 95 screen savers. The sound editing...it&#x27;s like every shot you will hear the difference in the background noise and by the time you see them &#x22;firing&#x22; guns your ears will explode due to the intensity of the sound. Forget about the plot because it doesn&#x27;t even need one. All in all I can say it&#x27;s a great movie to laugh at even when you are not drunk.	4
This is what happen if The Birds wasnt directed by Alfred Hitchcock, but a crazy fan of his	United States	Failure &#x96;noun 1. an act or instance of failing or proving unsuccessful; lack of success: 2. nonperformance of something due, required, or expected: 3. James Nguyen&#x27;s &#x22;Birdemic&#x22;. Birdemic is just plan awful. It&#x27;s doesn&#x27;t even belong in the &#x27;it&#x27;s so bad, it&#x27;s good&#x27; group of bad movies. It&#x27;s lacks any sense of entertainment. At first, I thought this was a student film, due to it&#x27;s windows movie maker CGI effects, wooden acting, audio conflict and bad editing shots, but no, this movie was just produce by James Nguyen, the modern day Ed Wood with Tippi Hedren serving as his Bela Lugusi. He never received any formal training in movie-making, but instead grew up watching the movies of Alred Hitchcock, including his 1963 picture &#x27;The birds&#x27;. It took the director four years to make this movie, and it&#x27;s still awful. Please James Nguyen, learn how to make a movie, please. Birdemic: Shock and Terror starts with the shocking and terrifying Rod (Alan Bagh) who the camera loves to show driving and walking over loop music, badly made sound effects, or blank silence. Rod meets up with aspiring fashion model Nathalie (Whitney Moore) and begins dating her. The dialogue between the two wooden actors are just bad. It&#x27;s like a hurricane blew through the script and devastated every line in it&#x27;s path. The whole idea of the two main characters being a couple is just awkward as both have no connection with each other, it felt like the actress didn&#x27;t really wanted to be there. The whole love story is just painfully to watch due to it&#x27;s dullish. The first part of the movie is so boring with non needed scenes, bad fade in and fade outs, and long pauses when cuts are needed. Most of the audience is just waiting for the birds to attack and kill these folks just because the movie need some type of entertaining value. Rod and Nathalie woke up to find that their town Half Moon Bay is under attack from CGI photoshop eagles and vultures that spit acid, disappear in end of shots and explode into flames upon striking the ground. I&#x27;m not a naturalist like Charles Darwin, but I don&#x27;t think birds explode or spit acid due to Global Warning effects. The movie love to mention Global Warning, but doesn&#x27;t really do a good job on explaining it. They even had a badly written doctor on a bridge to try to explain it, and he wouldn&#x27;t do the job. Even Al Gore would hate this movie. The whole plot is directless, and the movie tries to pay tribute to &#x27;The Birds&#x27;, but felt like a cheap knock off of that. The sound is horrible, there are scenes where the movie go silence, yet in others, such as the one at the beaches. The sound of the waves crashing, makes the movie hard to hear. Don&#x27;t get me started on the annoying sound during the attack, and things rubbing against the microphone. Oh god the bird screams, my ears are bleeding. I wasn&#x27;t even aware it was possible to fail this badly. It fails as a romance and it really fails as a horror flick. I try to look for any good notes for the film, and I can&#x27;t find anything worth noting. That&#x27;s how bad, I dislike this film. I can&#x27;t believe that they are even thinking of making a 2nd movie: Birdemic 2: The Resurrection. Birdemic is just pure cinematic failure on absolutely every conceivable level. I&#x27;m surprised it wasn&#x27;t written, produced, directed and starred in by Alan Smithee. This movie makes Troll 2 look like Orson Welles &#x27;Citizen Kane&#x27; or Tommy Wiseau &#x27;The Room&#x27; look like Godfather. Check it out at your own cost. It&#x27;s worth watching if you like your eyes prick by GIF clip-art birds.	1
Wretched	Earth (Middle)	Easily in the class of worst movies ever made, Birdemic has obsoletely nothing to recommend it other than a hilarious send-up of it by the folks at Rifftrax. The acting is horrible, the script is a mess of confusion, the directing is worse, and the special effects look like they were done by an 8yo on an old Quadra 660av. The movie lacks all the charm of something like Plan 9 From Outer Space and fits in well with dreck like Manos The Hand of Fate.If at all possible, avoid seeing this film. Drive many miles out of your way if need be.Even if you like bad movies in general, this movie will test your limits.	1
How did no one prevent this abomination from coming into being?	None	A lot of things have been said about this movie, I read most of the reviews, but nothing could prepare me for the clogged toilet full of sh*t that is birdemic. Don&#x27;t get me wrong I think you should see it, but it is truly the worst movie EVER.Okay the CGI is HORRIBLE, the sound transitions between scenes are so bad you will think somebody switched the channel and none of the actors have any real talent. The plot is more made up of mistakes than an actual story, all characters are one dimensional and boring at best. The best part of the movie is the worst part of a porn movie, seeing the chick in her underwear.Why I still think you should watch this is because of the leading role, Rod (or whatever), played by Alan Bagh. I think a cardboard cutout of the &#x22;They&#x27;re eating her! And then they&#x27;re going to eat me! Oh my GOOOOOOOOD!&#x22;-guy from troll 2 (search it on youtube if you haven&#x27;t seen it) would do a better job than this guy. He can not do a single movement naturally, seriously everything he does looks ridiculous. EVERYTHING. He can&#x27;t walk, talk, get into a car or even stand still like a normal person.The first half hour of the movie (no birds yet) is hilarious because of him stumbling around like someone who is recovering from a severe stroke and had most of his brain removed. Moore tries to save it and she&#x27;s actually not half bad (okay she&#x27;s pretty bad but so much better than Bagh) but it just doesn&#x27;t work because she has to act like she likes him. HE IS THE MOST BORING ZERO-DIMENSIONAL C*CKSUCKER EVER WHY WOULD ANYONE GIVE A SH*T ABOUT HIS HOBBIES OR HIS STUPID JOB.The plot is total garbage of course, but what bothers me most is the TOTAL LACK OF SENSE on Nguyens part. At one point they find a dead bird on the beach, but instead of getting a dead chicken somewhere they use a CGI bird. IT LOOKS TERRIBLE. WHY WOULD YOU DO SUCH A THING.This movie makes 2012: Ice Age look like Avatar. In comparison to this, Mega Shark Vs. Giant Octopus is worthy of 10 Oscars. It is unbelievable that anyone would produce this, did no one with a milligram of sense and taste watch this before it was brought out? Nguyen and everyone he knows should be whipped severely for making this hell spawn of a movie.Bottom line: Go watch it and be amazed at the unbelievable amounts of incompetence one can show in just 90 minutes. Don&#x27;t forget your eye bleach!	1
I dont know what to say	United States	Really, I&#x27;m at a loss. What can be said about a movie like Birdemic? All the reviews you can find detail the innumerable problems: the poor directing, the lack of consistent sound quality (including the famous &#x22;HI&#x22; from the waitress at the beginning), the crappy GIFs of birds sloppily pasted over the screen, which spit acidic orange juice and explode and make airplane noises, acting worse than the average porno, etc.But does this movie really deserve review? A review of a movie implies that it is.....well, a professional film. Birdemic is listed on a site alongside The Godfather and Avatar, and it received a theatrical release. But it doesn&#x27;t seem right. This movie simply does not exist in the same realm as what anyone would call a &#x22;movie.&#x22; It dips down into the 90s era of home movies, manufactured by a few high schoolers in the summer with a pirated copy of Adobe Aftereffects.What I&#x27;m saying is that to review this film on IMDb almost implies that it deserves being on the same 1 to 10 rating scale used for the rest of the films on this site. The rating scale doesn&#x27;t apply because it&#x27;s just not made like a movie.	1
Does anyone know how to erase memories?	United Kingdom	I cant quite begin to explain the magnitude of why this film is most definitely the most diabolical example of cinematography I have ever seen in my life....It started when a group of my friends stumbled across the trailer. After watching we thought &#x22;man this film looks so bad it must be worth a watch even if its to laugh at!&#x22; But oh no people this is not a film so bad its good... its just plain dreadful, and if any of you have seen the trailer then I say to you that its even worse than it looks(somehow, which I could never have dreamed was possible).Lets state the obvious: The acting was disastrous. I really hope these actors got paid in barley water or some other worthless item. I have seen primary school plays with more conviction. Any emotion that could have been displayed in the romantic scenes was so clearly fake its unreal. I mean the actors couldn&#x27;t even pretend to shoot properly, they just vaguely lifted up their guns and threw them about. Now this is probably something to do with the fact that this is without a doubt the worse example of the use of CGI in the history of man. I think men in bird suits would have done a better job. The birds were so fake they quite literally moved exactly with the camera as if stuck on even though they were done by computer!As for the story line I&#x27;m not sure how or why James Nguyen thought of the reasons given in the film but they are barely worth mentioning. And why there was a seemingly random crusade about global warming is beyond me as it made no sense as to why it was causing the birds to attack. Even worse than this was the little details. For example multiple times in the film the main cast decided to get out of their car and begin strolling around having picnics, without a care in the world. Then surprise surprise birds attacked. If the writer cannot think of legitimate reasons for the characters action he should perhaps go back to the drawing board (all though I&#x27;m pretty sure he spent about 5 seconds pondering if he could get away with this excuse for a screenplay). Now the not so obvious stuff: In the trailer you don&#x27;t even get a sense for how terrible the editing is. Events seem to occur at random times and in some scenes you can see the actors waiting for the director to shout &#x22;action!&#x22; (no joke you really can its like their all zombified for a few seconds, and this doesn&#x27;t happen just once!). When it comes to the lyrical component of the film you might as well give up now. Every few seconds back ground noise would change from complete silence to over powering fuzz where some shots were so obviously done at different times. It was like the actors were in different rooms, it was mad!Now the ending is possibly the worse bit. I wont completely ruin it but all in all the birds go away. That&#x27;s it! Why, we will never know.So unless you are on crack cocaine, are thinking of doing something slightly more fun than suicide or just plain out of your mind, please, I beg of you, don&#x27;t watch this film. No seriously don&#x27;t! You will wind up like me wishing that you had kicked your own mother&#x27;s head in or done some other task that was of more value than watching Birdemic.One last thought: How does flu make birds explode?	1
You have to see it to believe it!	United States	I love bad movies and watching bad movies. I was really excited to see birdemic because all the bad reviews I have heard. The first word that was said in this movie pretty much told me what i was in for. At the beginning of this movie I was excited to see a really crappy movie and make me laugh hard. I was terribly wrong. By the first hour I just wanted the movie to end. Not only the audio was the worst I have ever heard, the editing was a joke, the lighting was awful but besides all that it was terribly boring the first about 30-40 minutes. What i was hoping to see was birds attacking people for the whole movie in really ridiculous ways but in the first 30-40 minutes the movie was just a day and the life of a really average and boring guy. The character&#x27;s acting didn&#x27;t help at all either. Not only was the character boring but I feel like the film could have been only 30 minutes long if there weren&#x27;t so many shots of useless and pointless shots, mainly of them main character driving! It was just shot after shot of a car entering and leaving a shot. The worst part of this movie is the audio. The audio was is the most noticeable part of the movie. There are times when the person isn&#x27;t talking but they are still talking, ambient sound volume was being changed every other second. It was as if sound mixer brought up audio only when a character was talking then brought the sound back down when they finished. The final verdict is that if you are someone that love to laugh at bad movies this might not be for you because its just way to bad, but if you have to watch it then watch it with a ton of people and make jokes during the movie. You will not believe how bad this movie is. Oh and one more thing, prepare for some really lame social commentary over global warming.	2
