Another kind of family movie	nowhere	 The Godfather is one of the few films in which I personally did not find any significant weakness even after many viewings. From the direction, to the acting, to the storyline, to the score, The Godfather has the word classic written all over, and it really is not much of a surprise that it is now considered by many one of the top five movies of all time. Perhaps when it comes to cinematic techniques The Godfather has not been as revolutionary as Citizen Kane, but its influence on motion pictures is comparable. Rarely a movie has defined or re-defined a genre as much as this one did for &quot;gangster movies&quot;, but its influence goes well beyond that.The Godfather's influence has been so big through the years that elements of it can be found in virtually every &quot;organized crime film&quot; nowadays; almost every comedy featuring a gangster in the last few years has spoofed something in The Godfather. The Italian-American old mobster a-la Don Vito Corleone has become one of the most established figures in the public's imagination.But to say that The Godfather is simply &quot;influential&quot; is to diminish its true qualities, and so is to describe it simply as &quot;a movie about gangsters&quot;. The Mafia is certainly the main focus the story revolves around (despite the fact that the word is never mentioned), but although the movie never tries to forcedly insert separate subjects it contains an amount of psychological and social subtexts that cannot be overlooked. Considerations on how the social environments changes us, on how moral values appear different from different point of views, on how violence can destroy a human soul, and on how power can corrupt an individual are deeply blended into a story that stays practically always true to complete realism, and the result is a picture of astonishing efficacy and believability.As good as the direction and the story are, it would be unfair not to consider the major role that the actors' performances had in the cinematic triumph that was The Godfather. Praised by many as the best cast to ever appear in an American movie, all the cast in The Godfather succeeds in portraying complex, three-dimensional characters without ever making a slip. The exceptional portrayals of Don Vito and Michael Corleone respectively by Marlon Brando and Al Pacino, the performances by Robert Duvall, James Caan and Diane Keaton as Tom Hagen, Santino Corleone and Kay Adams, the ruthless Virgil Sollozzo played by Al Lettieri -- as well as more than a few other roles -- are all perfect for the movie, and they all succeed in making us believe these are real people, not just actors. We are not watching a central character and a bunch of incomplete figures that revolve around him: although Michael Corleone is the character that gets the most screen time, everybody is the center of this world his own way. The movie makes it possible for the viewers to identify with different characters and to observe how their personality and story fits in, and it does it much more effectively than many bloated multiple-storyline movies that came out in the last few years.The movie opens on the wedding of Don Vito Corleone's daughter, Connie (Talia Shire). Don Corleone is a powerful man, and it was not without the use of violence that he achieved this position during the course of his life. The wedding scene gives a perfect setting of where and how the Don's power extends; from the regular worker in a neighborhood, to the immensely popular singer, to the friends in politics and right to the ruthless killer, Don Corleone has links to people ready to ask him favors and to pay him back. Some are trustworthy, some are not, but thanks to his intelligence and intuit the Don can almost always distinguish the two.However, this is 1946, times are changing, and to many of the younger people working in the crime business, Don Corleone's ideas are becoming obsolete. The Don believes that the new trend in the business, narcotics, is too dangerous and the families dealing with it would eventually end up self-destroying; while his family had deals in alcohol and gambling for a long time, part of the Government and law enforcement was ready to close one eye. Drugs are another thing.To this day, Don Corleone was able to keep things together while maintaining his economic and political power, but things will brutally change when a powerful drug dealer name Sollozzo enters the picture. The refusal of Don Corleone to cooperate with Sollozzo, and a weakness immediately spotted by the latter, will ignite a war that will cost many lives, and that will see Michael Corleone, Vito's younger son and the one who never wanted to take part in the family business, lose his &quot;innocence&quot; and transform into a gangster as ruthless as the people he initially stood up against.I purposely decided not to spoil much about the plot because I believe that the film is perfectly enjoyed without knowing anything in advance, and -- believe it or not -- there are still quite a lot of people who have never seen this movie. There are multiple scenes that manage to create an incredible tension, various twists, and although like any other masterpiece The Godfather can be watched knowing the whole story beforehand and still be a phenomenal experience, I believe it is always a pleasure to see it for the first time and enjoy its multiple climaxes. Besides, to outline such complicated characters and such an emotionally intense story in a short review like this one would be inadmissible.There has been much speculation on how the events in The Godfather novel written by Mario Puzo, the book the film is based on, could be an expos&eacute; of true facts. Many believe that the character of Johnny Fontane , for instance, was based on Frank Sinatra's real life, and many of the other characters were modeled after real people. I won't go into that: frankly, I have no idea whether these voices are reliable, although the Frank Sinatra reference seems obviously quite believable.The cinematography of The Godfather is dark and tasteful, and colors are used perfectly to give a true feel of the era it is set in. There is a fair amount of violence, though rarely gratuitous.The Godfather certainly doesn't need my recommendation. The film is universally considered one of the best of all time, and the performances by Pacino and Brando alone is the stuff of legends.  	Plot	6
perfect	Winnipeg	 This movie is strong, good script, great casting, excellent acting, and over the top directing.  It is hard to fine a movie done this well, it is 29 years old and has aged well.  Even if the viewer does not like mafia type of movies, he or she will watch the entire film, the audiences is glued to what will happen next as the film progresses.  Its about, family, loyalty, greed, relationships, and real life.  This is a great mix, and the artistic style make the film memorable. 	Plot	8
The Greatest Movie Ever Made	Yorktown	 The Godfather is one of the very few films that doesn't have a single flaw. Seeing The Godfather for the first time was the most amazing movie experiences of my life.  There's scenes that stay with you when the movies over, and you don't forget them.   Everyone makes the mistake of calling this film a movie about crime.  Its really a movie about family.  The dialogue is just unbelievable.  I've seen the movie at least 30, 40 times, and I'm still amazed at how perfect it is.  The music, the acting, everything.  People think that Citizen Kane is the greatest movie ever made...well, there's no way  that ANYONE can think that Citizen Kane is more moving, and has a better storyline than The Godfather.  The thing I find so amazing about The Godfather is how Michael (Al Pacino) changes throughout the movie.   Its my opinion that this is the greatest movie ever made, and I doubt that anyone can watch this movie, and think I'm crazy. 	Actor	10
Initially, I wasn&#39;t a fan... but then I realised	Australia	This is a masterpiece. A timeless masterpiece. Initially, I didn&#39;t like this film all that much - I found it rather over-hyped and boring. This was until the advent of DVD, which gave me the feature I needed for this sort of film: subtitles. Once I switched them on and heard (read) every last word of Brando&#39;s ramblings and other characters ramblings, I grew a true appreciation for this epic.To make a true epic, you need all of three following ingredients working in near perfect harmony. For screenwriters who come across this, take the following pointers on board: 1) Contrasting Characters: Good films have some character distinction, but most fall rather flat because the core of each character is the same.Of course, there are exceptions to rule (ie... where you want mono-tonal characters... aka matrix; or where you want outlandish contrasts... aka The Fifth Element), but ultimately, this is what makes films deep, meaningful and grand. Consider the contrasts between the Don&#39;s children. Michael is rather cool, rational and collected, whereas Sonny is more hot-headed, spontaneous and simple minded. But simply having these contrasts is not nearly enough. What you really need to do is to develop these characters - place them in situations - and then dwell on how their character impacts on the situation they&#39;re put in. The Godfather is a terrific example of how to pull this off. While many try to do this in screenplays, most lose the plot and create character obscurities that stretch credibility.2) Transformation: The central character(s) must undergo a transformation, resulting in them being almost unrecognizable by the end of the film. By putting them into situations, the character&#39;s character must not only influence the outcome of the situation; it must also have a lasting impact on the character. Consider Michael at the wedding and compare that to the Michael we see at the end of the film. Again, many films try, but most fail because they come up with unreal (literally, not praisingly) or simply moronic transformations (eg, Wall Street).3) Patience: Men in Black 2 was an astounding film for one simple reason - it was an entire film squashed into about 70 minutes. It was not much longer than an episode of ER or Buffy. I certainly hope the new goal of Hollywood isn&#39;t to make films as short as possible.All the great ones spend time - time developing characters, family life, growth, patience with the story telling in general. This is the key (provided that the story isn&#39;t mind-numbingly boring). Dances with Wolves, Heat.. and so on are very patient but top-class films. While studios may be lukewarm on the idea of longer films, they are worth it if you have a ripper story to base it on.I feel that this film has not dated all that much and has tremendous re-watch-ability. 	Plot	9
The Pinnacle Of Flawless Films!	Worcester, England	'The Godfather' is the pinnacle of flawless films! The first time I viewed 'The Godfather' I was in my early teens and it was the most astounding film I had ever seen, and has since then stood as my all-time favourite film. It is due to this that I have been looking forward to writing a review of this unforgettable classic. So let's start from the beginning. The film opens to four words, 'I believe in America', it's crazy to think that this simple line has become a resonant quote solely due to the impact it made on the entrance to the film's 'threshold'. This is just one of the many renowned quotes that litter the film, and believe me, there are a lot. After the first take we are then absorbed into the life of Vito Corleone, brilliantly portrayed by the Oscar- winning performance of Marlon Brando. Vito is a feared man, he is a criminal, he is a mafioso, but above all he is a respected family man, his three sons are depicted by three excellent actors, James Caan, John Cazale and Al Pacino as well as his adopted child Tom Hagen, played by Robert Duvall. The film follows Vito as he attempts to transfer his crime empire to his reluctant son, Michael. With some of the most graphic and gruesome death scenes to have ever been seen in the 1970's film industry (including a certain horse's head), 'The Godfather' epitomises how violence can be used effectively within a film. The Corleone's are some of the greatest antiheroes to have ever been seen on screen, whilst they are villains, the audience will refuse to accept that fact, Coppola does something simple and audacious, he takes the guilt out of organised crime. A film rife with beautiful cinematography, memorable musical scores and well-paced action and drama. Overall, The Godfather is one of Hollywood's greatest critical and commercial successes that gets everything right; a gangster flick that is overflowing with life, rich with emotion and subtle acting, and further blessed with amazing direction from Francis Ford Coppola. Arguably the most unforgettable masterpiece to have ever been made. 	Plot	8
A Masterpiece	Casa Nostra	This must rank as the best film (along with part 2)of all time.An ensemble performance that has no weak spot.Particularly, John Cazale ( Fredo) and Richard Castellano ( Clemenza) give wonderfully understated performances. You just have to believe that Castellano WAS Clemenza, he brings a real touch to his role.John Cazale brings the troubled Fredo to life, and you can see the weak Fredo desperately trying to live up to the family reputation but knowing that he can never be what his father wants. The story of one man&#39;s reluctance to be drawn into the murky family business,and his gradual change through circumstance, paints a vivid picture of this violent period of US history.Do not miss this film! 	Actor	9
This Movie Has Haunted My Life...	United States	I love this movie and all of the GF movies. I see something new every time I have seen it (countless, truly). The story of tragedy and (little) comedy that exists in this film is easily understood by people all over the world. This film has been called an American story however I have met others who have seen this movie in other languages and they seem to have the same love and appreciation for it that I do. I love the characters and all of the different personalities that they represent not just in families but in society itself. It seems like the entire cast is part of every other movie that I love as well. The sounds, music, color and light in the film are just as much a part of the film as the people. This could be attributed to the method in which it was filmed. At many parts of the film I can still find myself feeling the emotions conveyed in the film. I never tire of appreciating this film. I thank God that FFC is an American treasure. We are fortunate to have him. 	Plot	6
The world inside the underworld!	United States	The godfather trilogy is an exclusive set of movies that will continue to live with humanity, every generation will see them to say, &quot;Oh that was 10 out of 10.&quot; If you watch them you will know that the world that lives inside the underworld is same as the one we live in except that people in underworld are so smart, in fact smartness is the only thing that can keep them there. Don Vito Caroleone's early life shown in part-II is very well done to show the Don in making, how a kid who couldn't even tell his name went on becoming a underworld don who keep most senators, judges and lawyers in his pocket. Meeting of don with the so call five families are among most impressive scenes.A saga that goes on for 9 continuous hours takes you around various walks in life of Mike (Don's younger son who become Don later), his school days, love life, personal life, family life, business life, political life and religious life. How all of these different roles Mike plays in his life and how intertwined these are.I enjoyed watching these movies so much, I wish I had seen them much before then I did. Its amazing to see how the Part-III was made 18 years later the part-I was made and everything looks so continuous if watch them together.I need not say much! The Godfather father trilogy been around for a while and everyone knows that they are great set of movies, its just the matter of when you actually get to see them.Watch them! Kudos to Francis Ford Coppola! -Vishy 	Plot	7
To call it a sequel is a travesty	None	 This movie is way to be good to be labelled a sequel to The Godfather . Rather it is more of a companion piece to the original and the two perfectly compliment each other . IT is both a sequel and prequel showing the rise of the young vito and moral decline of Micheal . Both characters are brought to life with uncanny ability by Robert  DeNiro and Al Pacino . To say that these two are good actors is like saying that a nuclear bomb makes a loud noise and in this movie they prove why they are at the top of their respective crafts .Al Pacino is the standout in the ensemble cast and its amazing how his eyes have changed from the first part . They are now cold , ruthless and unemotional and betray the price which Micheal Corleone has paid for power .Watch this movie and learn why it is the greatest gangster film of all time.  	Plot	8
The Greatest Film Ever Made	Canada	 The original Godfather is a brilliant work. It is in a sense a voyeuristic delight, allowing us to see the mafia from the inside - we become part of the family. It single-handedly change the world's view of organized crime, and created a cast of sympathetic characters, none of whom have a shred of common morality. It was the highest grossing movie of its time and Brando created a cultural icon whose influence resonates as strong today as it did in 1972.As extraordinary an achievement as this is, Part II is even better. It easily receives my nod as the best picture ever made. I have seen it at least 20 times, and each time its 200 minutes fly by.The movie uses flashbacks to brilliantly weave two tales. The main story is the reign of Michael Corleone as the world's most powerful criminal. Now reaping the benefits of legalized gambling in Las Vegas, Michael is an evident billionaire with an iron fist on a world of treachery.Behind this, Director Francis Ford Coppola spins the tale of the rise of Michael's father, Vito, to the center of the New York mafia. It is these scenes that make the film a work of art. Without spoiling, I will simply say the Robert DeNiro as the young Vito is the best acting performance of all time, a role  for which he won a richly deserved Oscar.The screenplay is full of delicious little underworld nuggets (&quot;Keep your friends close .....&quot;, &quot;I don't want to kill everyone, just my enemies&quot;), while it blows a dense, twisted plot past you at a dizzying and merciless pace. The cinematography is depressing and atmospheric. The score continues in the eerie role of its predecessor, foretelling death and evil.All of this makes the movie great and infinitely watchable. But it's what's deeper inside this film ... what it is really about ... that is its true genius.The Godfather Part II is not really a movie about the mafia, it is a movie about a man's life long struggle. Michael controls a vast empire that is constantly slipping out of his hands. He grows increasingly distrustful and paranoid, and even shows signs that he hates his own life. Michael almost seems to resent the fact that he is a natural born crime lord, a man who puts the family business ahead of everything.The great Don Michael Corleone can never come to terms with one simple fact.... his father's empire was built on love and respect, Michael's empire is built on fear and violent treachery.See this movie. It's three-and-a-half hours very well spent. 	Plot	10
One of the Best Sequels Ever	Canada, ontario	 You can count on one hand the movie sequels that measure up to the original; GODFATHER II makes the cut. This movie is just as fine as GODFATHER I. Here the director goes back and forth between the early days of the young Vito Corleone, played by Robert De Niro, and the family after the action in GODFATHER I in the 1950's just before Castro came to power. Michael Corleone (Al Pacino) has moved the family and most of his business to Nevada. Once again the acting is flawless. Diane Keaton as Michael's wife who quickly becomes disillusioned with her life with him and the lies he continues to tell her, assuring her that he is going legitimate soon; Robert Duvall as Michael's adopted brother and adviser; and Lee Strasberg as Hyman Roth all give outstanding performances; but the film really is Al Pacino's. We see him become a ruthless, cold-blooded killer who alienates himself from his family in ways his father would never have done. He has come so far from the idealistic young man in &quot;GODFATHER I, who joined the Marines in World War I to serve his country and die for it if necessary, to a lonely, paranoid tragic man. There are many poignant scenes concerning his wife and children-- the drawing his son leaves for him in his bedroom, the gift that Tom buys the child because Michael is too busy, his wife Kay's being kept a virtual prisoner at his orders in the family compound, etc.Once again many acts of violence are interwoven with religion: Michael's son's first communion, the religious parade in New York, Fredo's repeating the Rosary in order to catch a fish, for example. The cinematography is stunning; the footage from Sicily and New York around the turn of the century and the snow scenes from the American West are beautiful and rich in detail. Mr. Coppola has directed yet another masterpiece.  	Plot	8
Great ensemble acting, great story, greatest sequel ever made.	Derbyshire, UK	 The Godfather Part 2 is the finest sequel ever made and is arguably a finer film than the original Godfather. The film is divided into two main parts - the story of a young Vito Corleone (flawlessly acted by Robert De Niro and a worthy Oscar winner) and the rise to power of Michael as the head of the family. Francis Coppola recollaborated with many of the crew members of the first film and again achieves a quite superb period piece thanks to the cinematography of Gordon Willis and set design of Dean Tavoularis. The acting performances are outstanding, hence three supporting oscar nominations for acting guru Lee Strasberg (Hyman Roth), Michael Gazzo (Frank Pentangeli) and Robert De Niro (young Vito Corleone). Duvall, Keaton, Cazale and Shire all provided first rate performances but it is the performance of Al Pacino which steals the show, expertly portraying Michael as a cool, calculating, suspicious Don Corleone. The film expands upon the original movie and brings us into the family's activities in Nevada, Florida and Havana. Arguably the finest movie of the 70s, a cinematic masterpiece with the greatest ensemble acting you will probably see. 	Actor	9
Breathtaking in its scope and tragic grandeur...	Mexico	Coppola's masterpiece is rivaled only by &quot;The Godfather, Part II&quot; in which the 1940s setting of the first movie is extended backwards and forwards to reveal the corrupting effect of power...The film, breathtaking in its scope and tragic grandeur, shows two parallel stories extending two different time periods: the early career of young Vito Corleone seen first around the turn of the 20th century in Sicily, and then in 1917, building his criminal underworld in the Italian ghettos of New York City, post World War I, plus that of his son, Michael (Al Pacino) desperately trying to keep his family together...Al Pacino's performance is quiet and solemn... He is cold and ruthless, with a whole contrast from the idealistic innocent war hero we initially met at the beginning of the first film... Here he's a calculating and frightening force, seeking to expand casinos into Pre-Revolutionary Cuba and consolidating an empire surrounded by perfidy and treason, maintaining total confidence in his ability to control the situation whether testifying before enraging Senators or trying to outface his worst enemies...The film's haunting final shot of a lonely, isolated paranoid Michael in his empty compound, is an unforgettable movie scene, a tragic portrait of a lonely and fully damned person, emotionally empty and finished, far from a waspish wife, more distant from a faithful lawyer...De Niro's rise, from an orphan child by a family feud back in Italy to a hood in New York and his position as a respected Don, provides a welcome break from Pacino's relentless attitude... Since the people he kills seem to deserve it, Vito comes off better than Michael does, and it was wise of Coppola to shuffle the two stories together despite lengthy flashbacks and the disturbance of continuity...The entire cast contributes greatly to the success of the film: Lee Strasberg, a fascinating mixture of lust and ruthlessness; G. D. Spradlin, absolutely right as the sinister and corrupt Nevada Senator; Michael V. Gazzo, unforgettable as the troubled gray-haired informer; Gastone Moschin, excellent as the blackmailer in white suit; John Cazale, marvelously timid as the vague, confused, and hesitant Fredo; Diane Keaton, clearly irrational as the long-suffering wife Kay; Talia Shire, too extravagant as the lousy mother; Troy Donahue too ambitious as the fortune-hunting suitor; and Robert Duvall excels as the confidant, and retainer to the all-powerful Corleone family...Coppola's motion picture is not just a mere supply with new characters and events from the original, it's a far more complex and intimate movie than its predecessor... It is not really a sequel... It's just more... It cleverly shifts in time between two distinct narratives with extreme realistic violence and criminal mentality of gangsters... 	Plot	8
